Strain,Company,Types,Categories,THC level,Price,Feelings,Flavor,Description,THC level numeric,Price numeric
TTM | Mystery Moon | 100mg,To The Moon,Hybrid,Edibles,100mg,$30.00 ,"Calm,Happy,Relaxed,Energetic,Uplifted,Creative",Not Specified,"Edibles are created either by infusing cooking oil or butter with cannabis extract, or by mixing extract directly into other ingredients. Because edibles are digested and absorbed by your stomach and liver, the activation is often longer than other consumption methods, taking on average 45 minutes, and sometimes up to 2 hours. It is important to start low and slow when consuming edibles so you don't over do it. Take extra caution to ensure edibles are out of the reach of children.",100,30
TTM | The Grape Gazoo | 100mg,To The Moon,Hybrid,Edibles,100mg,$30.00 ,"Calm,Happy,Relaxed,Energetic,Uplifted,Creative,Uplifted,Inspired",Not Specified,"Edibles are created either by infusing cooking oil or butter with cannabis extract, or by mixing extract directly into other ingredients. Because edibles are digested and absorbed by your stomach and liver, the activation is often longer than other consumption methods, taking on average 45 minutes, and sometimes up to 2 hours. It is important to start low and slow when consuming edibles so you don't over do it. Take extra caution to ensure edibles are out of the reach of children.",100,30
Hard Cider,Aeterna,Hybrid,Flower,22%,$50.00 ,"focused,Happy,Relaxed,Energetic",Not Specified,Dried cannabis flower is primarily ingested via inhalation. Activation time is roughly about 5 minutes and can last up to a few hours.,22,50
Gushers | Jar,Dank,Hybrid,Flower,31%,$53.00 ,"focused,Happy,Relaxed,Energetic",Not Specified,Dried cannabis flower is primarily ingested via inhalation. Activation time is roughly about 5 minutes and can last up to a few hours.,31,53
Fire OG,Dank,Hybrid,Flower,28.70%,$44.00 ,"Hungry,Sleepy,Euphoric","lemon,spicy herbal,pine","Fire OG, also known as ""Fire OG Kush,"" is a indica-dominant hybrid marijuana strain made by crossing OG Kush and SFV OG Kush. This strain has an aroma similar to Lemon Pledge and has euphoric effects that are potent and long-lasting. Fire OG is one of the strongest OG strains, and is a fan favorite among consumers who have a high THC tolerance. Fire OG gets its name from the frosty red hairs that make the strain appear to look like it is on fire. Fire OG plants typically flower in 9-10 weeks.",28,44
Cheetah Piss | 3.5g,DEALER CANNABIS CO.,Hybrid,Flower,21.59%,$26.00 ,"focused,Happy,Relaxed,Energetic",Not Specified,Dried cannabis flower is primarily ingested via inhalation. Activation time is roughly about 5 minutes and can last up to a few hours.,21,26
Kush Mints| 3.5g,DEALER CANNABIS CO.,Hybrid,Flower,21.52%,$26.00 ,"Relaxed,Aroused,Euphoric","mint,Menthol","Kush Mints is a hybrid weed strain made from a genetic cross between Animal Mints and Bubba Kush. This strain is 50% sativa and 50% indica. Kush Mints is a potent and flavorful strain that has a minty and cookie-like aroma and flavor, with hints of gas and pine. It has a balanced high that is both relaxing and euphoric, with a pleasant body buzz and a creative mind. Kush Mints is 28% THC, making this strain an ideal choice for experienced cannabis consumers. Leafly customers tell us Kush Mints effects include feeling relaxed, euphoric, and aroused. Medical marijuana patients often choose Kush Mints when dealing with symptoms associated with anxiety, stress, and depression. Bred by Mr. Nice Seeds, Kush Mints features flavors like mint, menthol, and pine. The dominant terpene of this strain is limonene. The average price of Kush Mints typically ranges from $15-$20 per gram. Kush Mints is a rare and exclusive strain that is not widely available, so if you find it at your local dispensary, don?t hesitate to try it out. If you?ve smoked, dabbed, or consumed Kush Mints, tell us about your experience by leaving a strain review.",21,26
Grandi Guava,Florist Farms,Hybrid,Flower,28%,$70.00 ,"focused,Happy,Relaxed,Energetic,Focused,Uplifted",Not Specified,"An incredible cross that?ll let you have your cake and eat it too. This strain shows its colors with classic purple-green lacing and a healthy frost. Ripe fruit from the Gelato lineage pull through on the nose with a blue-cheese undertone, this strain is the whole charcuterie board. Extremely relaxing to the body, this strain will also help quiet the mind and provide much-needed tranquility.",28,70
Peanut Butter Breath,Platinum Reserve,Hybrid,Flower,30.45%,$46.00 ,"Relaxed,Sleepy,Hungry","nutty,butter,chestnut","Peanut Butter Breath, also known as ""Peanut Butter"" and ""Peanut Breath,"" is a hybrid marijuana strain known for its sedating effects. Crossed with Do-Si-Dos and Mendo Breath, Peanut Butter Breath has a unique nutty and earthy terpene profile when smoked. Beyond the terps, this strain will bring you down into a quality state of chill and relaxation. Originally from ThugPug Genetics, Peanut Butter Breath is very popular and there are many Do-Si-Dos and Mendo Breath crosses out there?breeders Clout King have one called ?Peanut Butter Cup.?",30,46
White Cherry Runtz | Flower Bag,Pura,Hybrid,Flower,25.00%,$45.00 ,"Relaxed,Happy,Focused,Energetic",Not Specified,"Evenly balanced at 50/50 on the indica/sativa spectrum, White Cherry Runtz is sweet and tangy with a lavender aroma and flavors of berry and rose. Users report enjoyable euphoric and tingly feelings when consuming White Cherry Runtz.",25,45
Cosmic Crashers,Verde Lucido,Hybrid,Flower,22.51%,$32.00 ,"Happy,Focused,Uplifted",Not Specified,Dried cannabis flower is primarily ingested via inhalation. Activation time is roughly about 5 minutes and can last up to a few hours.,22,32
End Game| Moonrocks,Veterans Choice Creations,Hybrid,Flower,59%,$66.00 ,"Uplifted,Happy",Not Specified,"Elevate your senses to cosmic heights with Space Buds Moon Rocks by Veterans Choice Creations. Comprised of our premier Endgame hybrid strain, these moon rocks combine flower, hash rosin, THCA, kief, and bubble hash for an unparalleled experience. Expertly grown by SEGA Farms and bred by Ethos Genetics, this product epitomizes quality and potency.Components and Potency Total Cannabinoids: 69%Total THC: 59%Minor Cannabinoids: Balanced blend of THCV, CBC, CBN, CBD, and 1.5% CBG Experience Endgame Moon Rocks offer a balanced and potent experience,designed to deliver a multi-faceted high. Each component adds its own layer of complexity and depth, making for a truly unique cannabis journey.Terpene Profile Our Endgame blend features a rich terpene profile led by primary terpenes like R-limonene and alpha-pinene, contributing to a unique and nuanced experience.How to Consume Method of Consumption Smoking: Break the Moon Rocks into smaller pieces and mix with your regular cannabis flower in a pipe or rolling paper.Vaping: Use a vaporizer designed to handle concentrates. Place a small amount of Moon Rocks into the chamber and vape at a low temperature.Recommended Dosage Beginners: Start with a piece about the size of a BB pellet (~0.1 grams). Wait 30-60 minutes before considering additional consumption.Experienced Users: A pea-sized piece (~0.2 to 0.3 grams) should suffice. Again, wait 30-60 minutes to assess effects.",59,66
Carbon Fiber,Zizzle,Hybrid,Flower,24.71%,$52.00 ,"Talkative,Hungry,Aroused","chemical,pepper,ammonia","Carbon Fiber is a hybrid weed strain made from a genetic cross between Grape Pie, Biscotti, and Cookies and Cream. Carbon Fiber is 24% THC and 1% CBG, making this strain an ideal choice for moderate and experienced cannabis consumers. Leafly customers tell us Carbon Fiber effects include talkative, aroused, and euphoric. Medical marijuana patients often choose Carbon Fiber when dealing with symptoms associated with lack of appetite, anxiety, and depression. Bred by the incomparable Cannarado Genetics, Carbon Fiber features flavors like pepper, earthy, and chemical. The dominant terpene of this strain is caryophyllene. The average price of Carbon Fiber typically ranges from $50?$75. If you?ve smoked, dabbed, or consumed Carbon Fiber, tell us about your experience by leaving a strain review.",24,52
Banana Jealousy | Dimes,HUDSON CANNABIS,Hybrid,Flower,24%,$9 ,"Calm, Happy, Relaxed, Energetic",Not Specified,N/A,24,9
Triple Infused | Cheetah PizzxOreoz | Tsunami,7 SEAZ,Hybrid,Pre-rolls,31.38%,$25.00 ,"Relaxed,Happy,Focused,Energetic",Not Specified,Dried cannabis flower is primarily ingested via inhalation. Activation time is roughly about 5 minutes and can last up to a few hours.,31,25
Triple Infused | ZkittlesxWhite Runtz | Tsunami,7 SEAZ,Hybrid,Pre-rolls,49.01%,$25.00 ,"Focused,Happy,Relaxed,Energetic,Inspired,Uplifted",Not Specified,"Rolled up and ready to smoke, Pre-Roll packs are a convenient and effective way to consume cannabis. Pre-Roll packs generally contain smaller pre-rolls so that each can be consumed in one sitting.",49,25
Triple Infused | Pink GuavaxSunset | 5pk | Tidal Waves | 0.5g,7 SEAZ,Hybrid,Pre-rolls,35.19%,$55.00 ,"Calm, Happy, Relaxed, Energetic, Uplifted",Not Specified,"Rolled up and ready to smoke, Pre-Roll packs are a convenient and effective way to consume cannabis. Pre-Roll packs generally contain smaller pre-rolls so that each can be consumed in one sitting.",35,55
Triple Infused | RainbowxGelato 41 | Tsunami,7 SEAZ,Hybrid,Pre-rolls,36.68%,$25.00 ,"Focused,Happy,Relaxed,Energetic,Inspired,Uplifted",Not Specified,"Rolled up and ready to smoke, Pre-Roll packs are a convenient and effective way to consume cannabis. Pre-Roll packs generally contain smaller pre-rolls so that each can be consumed in one sitting.",36,25
Apple Pop | Infused  | 6 Pack,Animal,Hybrid,Pre-rolls,40%,$65.00 ,"Creative, Energetic, Happy",Not Specified,N/A,40,65
Biscotti,Bannermans Batch,Hybrid,Pre-rolls,23.28%,$100.00 ,"Tingly,Relaxed,Hungry","vanill,diesel,honey","Biscotti is a potent indica-dominant hybrid marijuana strain reportedly made by crossing Gelato 25 with Sour Florida OG. Others report that Biscotti is Motorbreath x G41. This strain produces a cerebral high that leave consumers feeling relaxed, creative, and buzzy from head-to-toe. The effects of Biscotti are known to creep up on consumers, so it's best to take it slow with this strain. In terms of flavor, Biscotti tastes like sweet cookies with undertones of diesel. With a THC level of 21%, medical marijuana patients turn to this strain to relieve symptoms associated with stress, anxiety, and depression. The striking trichome coverage of this strain gives it top shelf appeal. Biscotti was originally bred by Cookies Farms. If you've smoked, dabbed, or consumed this strain before, tell us about your experience by leaving a review.",23,100
Dosi | 1g,Cornucopia,Hybrid,Pre-rolls,15%,$12.00 ,"Relaxed,Happy,Focused,Energetic",Not Specified,"Elevate your cannabis experience with our premium Hybrid Dosi 1 Gram Pre-Roll, masterfully infused with high-quality kief. Hand-selected Dosi Do flowers, known for their potent effects and aromatic profile, are used to create this top-tier pre-roll. Enjoy a substantial and satisfying session with a full gram of premium flower in every pre-roll. Whether you?re looking to enhance your creativity, relax your body, or simply enjoy a premium smoke, the Dosi Do 1 Gram Pre-Roll Infused with Kief is your perfect companion.",15,12
Zkittles | 1g,Cornucopia,Hybrid,Pre-rolls,19%,$12.00 ,"Relaxed,Happy,Focused,Energetic",Not Specified,"Experience the vibrant, essence of Hybrid Zkittles in a convenient pre-roll format,enhanced with the potent addition of kief. Each pre-roll is expertly crafted using premium Zkittles flower, known for its balanced and relaxing effects, Zkittles provides a mellow,euphoric high that can help relieve stress and enhance mood without overwhelming the senses.",19,12
Lemon Cherry Gelato | Infused | Joint | 0.5g,Dank,Hybrid,Pre-rolls,35%,$14.00 ,"Relaxed,Happy,Focused,Energetic",Not Specified,"Step into the world of sweet indulgence with our Bubble Gum Gelato and Cotton Candy Breath duo, housed in our signature Deuces dual-chamber tank. On one side, Bubble Gum Gelato tantalizes with its creamy sweetness and hints of nostalgic bubble gum flavor. Meanwhile, Cotton Candy Breath on the other side offers a sugary delight that'll leave you craving more. Both strains deliver the soothing and relaxing effects characteristic of indica varieties, perfect for unwinding after a long day and melting away stress. Whether you prefer to savor each flavor individually or blend them for a unique experience, Deuces gives you the freedom to customize your journey. Get ready to double your enjoyment with our Bubble Gum Gelato and Cotton Candy Breath combo - because why settle for one flavor when you can have two?",35,14
White Widow | Infused | Joint | 0.5g,Dank,Hybrid,Pre-rolls,28%,$16.00 ,"Energetic,Talkative,Uplifted","woody,spicy herbal,earthy","White Widow is a hybrid weed strain made from a genetic cross between a Brazilian sativa landrace and a resin-heavy South Indian indica. This strain is 60% sativa and 40% indica. White Widow is one of the most famous strains worldwide, first bred in the Netherlands by Green House Seeds in the 1990s. Its buds are white with crystal resin, warning you of the potent effects to come. A powerful burst of euphoria and energy breaks through immediately, stimulating both conversation and creativity. White Widow is 15% THC, making this strain an ideal choice for moderate cannabis consumers. Leafly customers tell us White Widow effects include feeling energetic, talkative, and creative. Medical marijuana patients often choose White Widow when dealing with symptoms associated with stress, anxiety, and pain. White Widow features flavors like woody, spicy/herbal, and earthy. The dominant terpenes of this strain are myrcene and caryophyllene, though growing conditions and strain phenotypes may impact the exact blend. The average price of White Widow typically ranges from $8-$12 per gram. White Widow is a balanced hybrid that can be enjoyed by both indica and sativa lovers. It has a flowering time of 8-9 weeks and can be grown indoors or outdoors in mild climates. It produces chunky and conical buds with a loose and fluffy texture that are easy to break up despite their stickiness. If you?ve smoked, dabbed, or consumed White Widow, tell us about your experience by leaving a strain review.",28,16
Rose | Botanicals,Drew Martin,Hybrid,Pre-rolls,40%,$20.00 ,"Focused,Happy,Relaxed,Energetic,Inspired,Uplifted",Not Specified,"BE OPEN | Rose Petal + Hybrid The gentle aroma of rose petals envelops you, clearing your mind. A refreshing tingle of peppermint swirls around the hybrid cannabis cultivar leaving you feeling balanced and more open to the world around you. You exhale, ?Be open.? This curated blend of cannabis and botanicals was formulated by Drew Martin, an award-winning mixologist and herbalist, to harness the power of plants through cannabinoids, terpenes, and botanicals.",40,20
Lavender | Botanicals | 2 Pack,Drew Martin,Hybrid,Pre-rolls,29%,$20.00 ,"Focused,Happy,Relaxed,Energetic,Inspired,Uplifted",Not Specified,"BE OPEN | Rose Petal + Hybrid The gentle aroma of rose petals envelops you, clearing your mind. A refreshing tingle of peppermint swirls around the hybrid cannabis cultivar leaving you feeling balanced and more open to the world around you. You exhale, ?Be open.? This curated blend of cannabis and botanicals was formulated by Drew Martin, an award-winning mixologist and herbalist, to harness the power of plants through cannabinoids, terpenes, and botanicals.",29,20
Velvet Lushers | 7 Pk,Florist Farms,Hybrid,Pre-rolls,25%,$38.00 ,"Focused,Happy,Relaxed,Energetic,Inspired,Uplifted",Not Specified,"Rolled up and ready to smoke, Pre-Rolls are a convenient and effective way to consume cannabis. Pre-Rolls come in many different forms and can be rolled with flower, shake, ""b-buds"", infused with concentrates, and more.",25,38
Super Boof | 7 Pk,Florist Farms,Hybrid,Pre-rolls,28%,$38.00 ,"Giggly,Hungry,Euphoric","orange,grapefruit,blue cheese","Super Boof is a zingy hybrid weed strain made by crossing Black Cherry Punch and Tropicana Cookies. It has the same chunky, deep green buds as its parents that look wet with silver calyxes. The effects of Super Boof are believed to be intensely relaxing and giggly. Reviewers on Leafly say this strain makes them feel euphoric, creative and focused. Medical marijuana patients say they buy Super Boof for gastrointestinal disorders, depression, and fibromyalgia. Super Boof regularly tests at 28% THC. The dominant terpene is myrcene, which translates to earthy, and cherry notes. The original breeder of the Super Boof strain is California's Blockhead, who named it ""Blockberry."" Grower Mobile Jay selected a variety and named it Superboof.",28,38
Pause | Cherry Noir | 10 Pack,Honeybee Collective,Hybrid,Pre-rolls,22.36%,$59.00 ,"Happy,Relaxed,Creative,Focused,Uplifted",Not Specified,"PAUSE - (Hybrid) A Relaxing, Chill Experience Pause to reset your day while hanging with friends, watching a movie, or walking your dog. The anytime pre-roll.",22,59
Party - Hella Jelly | 10 Pack,Honeybee Collective,Hybrid,Pre-rolls,26.62%,$59.00 ,"Focused,Happy,Relaxed,Energetic,Inspired,Uplifted",Not Specified,"PARTY - (Hybrid) An Energetic, Happy Experience Perfect for a day on the slopes, a summer BBQ, or a deep house clean, these pre-rolls bring the party energy",26,59
Pause | Gazurple | 2 Pack,Honeybee Collective,Hybrid,Pre-rolls,18.62%,$15.50 ,"Focused,Happy,Relaxed,Energetic,Inspired,Uplifted",Not Specified,"PAUSE - A Relaxing, Chill Experience Pause to reset your day while hanging with friends, watching a movie, or walking your dog. The anytime pre-roll.",18,15.5
Gelato | Liquid Diamond | 5 Pack,Luci,Hybrid,Pre-rolls,19.52%,$56.00 ,"Focused,Happy,Relaxed,Energetic,Inspired,Uplifted",Not Specified,"This evenly balanced hybrid is known for its energizing and creative effects making it the perfect strain for daytime and social use. each joint is filled with new york grown flower, coated with high-terpene liquid thca diamonds, and rolled in kief.",19,56
Lemon Cane x Gelonade Resin,MFNY,Hybrid,Pre-rolls,28.77%,$20.00 ,"Focused,Happy,Relaxed,Energetic,Inspired,Uplifted,Creative",Not Specified,"Rolled up and ready to smoke, Pre-Rolls are a convenient and effective way to consume cannabis. Pre-Rolls come in many different forms and can be rolled with flower, shake, ""b-buds"", infused with concentrates, and more.",28,20
Big Apple Fritter | 3 Pack,Zizzle,Hybrid,Pre-rolls,25%,$26.00 ,"Relaxed,Happy,Focused,Energetic",Not Specified,"Big Apple Fritter is a hybrid strain that is known for its deliciously sweet and spicy flavor, reminiscent of a freshly baked apple pastry. It is a cross between Apple Fritter & the original NY Sour Diesel, resulting in a well balanced hybrid that offers both physical relaxation and mental clarity, The THC levels of Big Apple Fritter can range from moderate to high, Its effects are known to be both cerebral and physical, inducing a sense of happiness, euphoria, and relaxation. It is an ideal strain for unwinding after a long day!Big Apple Fritter has dense, dark green buds that are covered in a thick layer of trichomes. Its flavor profile is sweet and spicy, with hints of apple, cinnamon, and nutmeg, making it a popular choice among those who enjoy sweet strains.",25,26
Apple Fritter,N/A,Hybrid,Pre-rolls,29%,$270.00 ,"Relaxed,Tingly,Giggly","apple,butter,cheese","Apple Fritter, a true hybrid weed strain, is known for its powerful and relaxing high. Put out by Lumpy?s Flowers, the Apple Fritter marijuana strain is a reported cross of Sour Apple and Animal Cookies. According to Leafly reviewers, Apple Fritter?s effects include feeling relaxed, giggly, and tingly. It's a great hybrid, combining the stone of GSC with the energy of a diesel. Apple Fritter cannabis has a flavor and aroma that come off as sweet and earthy, with a light, cheesy, apple pastry influence.",29,270
Peace | Bubble Gum x Chem 1 | 2 Pack,Honeybee Collective,Hybrid,Pre-rolls,16.79%,$15.50 ,"Focused,Happy,Relaxed,Energetic,Inspired,Uplifted,Sleep",Not Specified,"PEACE - A Soothing, Restful Experience Reach for Peace pre-roll before a yoga session, a midday nap, or while getting ready for bed, and let the smoke comfort your soul.",16,15.5
Peace | Gelato Cake | 10 Pack,Honeybee Collective,Hybrid,Pre-rolls,22.34%,$59.00 ,"Focused,Happy,Relaxed,Energetic,Inspired,Uplifted,Sleep",Not Specified,"PEACE - Gelato cake is a potent indica-dominant.A Soothing, Restful ExperienceReach for Peace pre-roll before a yoga session, a midday nap, or while getting ready for bed, and let the smoke comfort your soul.",22,59
Calm | Mood | AIO | (CBD),ayrloom,Hybrid,Vaporizers,90%,$35.00 ,Relaxed,Not Specified,"Pure balance. expect a soothing and tranquil experience with ayrloom mood?s calm vape. a blend that?s both earthy and subtly sweet with lavender + red berry notes. perfect for an outdoor activity to calm the mind + connect with nature.INGREDIENTS CANNABIS EXTRACT, BOTANICALLY DERIVED TERPENES INSTRUCTIONS INHALE FOR 3-5 SECONDS. WAIT AT LEAST 30 SECONDS BETWEEN PUFFS. STORE VERTICALLY AND AT ROOM TEMPERATURE AWAY FROM LIGHT.",90,35
Orange Creamsicle | Vape Cart,ayrloom,Hybrid,Vaporizers,90%,$60.00 ,"Focused,Happy,Relaxed,Energetic",Not Specified,ORANGE AND CREAM LIKE A MIDSUMMER NIGHT?S DREAM. DECADENT VANILLA AND TANGY ORANGE TEAM UP TO BRING YOU CREAMSICLE.,90,60
Cereal Milk | AIO,ayrloom,Hybrid,Vaporizers,90%,$35.00 ,"Aroused,Giggly,Relaxed","vanilla,butter,sweet","Cereal Milk is a hybrid marijuana strain from Cookies. Cereal Milk is made by crossing Y Life (Cookies x Cherry Pie) and Snowman, a sativa-dominant Cookies pheno. Cereal Milk has a loud flavor with a sweet milk and ice cream nose that will keep you dipping back into your stash. You can expect dense, quality nugs dripping with trichomes and a potent high.",90,35
Watermelon | AIO,ayrloom,Hybrid,Vaporizers,90%,$35.00 ,Happy,Not Specified,Cannabis vaporizers are a great way to consume discreetly and consistently. Vape cartridges contain concentrated cannabis oil that is heated by a battery and vaporized for inhalation. These products are very potent and are designed to be consumed in 2-3 second puffs.,90,35
Caramel Latte | AIO | 1g,Cannabals,Hybrid,Vaporizers,88%,$65.00 ,"Calm,Happy,Relaxed,Energetic",Not Specified,"Cannabis-infused vapor inhaled from a liquid cannabis concentrate heated with an electric-powered device or battery. Vaporization allows for inhalation of higher-potency concentrate with a delivery method that is an alternative to smoking, but typically with the same immediate onset.",88,65
Watermelon Z | AIO | 1g,Cannabals,Hybrid,Vaporizers,88%,$65.00 ,"Calm,Energetic,Happy,Telaxed",Not Specified,"These mouth-watering Watermelon Fritter gummies are unlike any other edibles you've tried. Our vegan, full-spectrum gummies are infused with MFNY?s premium Apple Fritter live rosin extract. Superior to distillate, live rosin is made via solventless extraction from premium fresh frozen plants, preserving all the natural terpenes and tantalizing earthy flavors of the Apple Fritter strain, paired with the natural flavor of watermelon.",88,65
Jealousy | Disposable | 0.5g,EUREKA,Hybrid,Vaporizers,93%,$40.00 ,"Energetic,Tingly,Talkative","berry,pear,tropical","Unleash your harmonic extrovert with the Artisan Series Mystical Melody. Mystical Melody brings you lush red raspberries with a pungent squeeze of lime and tangerine. Inspire your palate as you inhale, and exhale melodious conversation and rhythmic creativity. This balanced Hybrid will invite your spirit to roam gleefully free with a force of euphoric vitality. Have the all-day stamina to manifest and embody your own brilliant gifts.",93,40
Grape Limeade | Disposable | 0.5g,EUREKA,Hybrid,Vaporizers,92.96%,$60.00 ,"Calm,Happy,Relaxed,Energetic","Paranoid,Dizzy,Dry eyes","""The FUSION split pack.5g brings you our pure & potent distillate combined with naturally derived fruit terpenes in a convenient,rechargeable vape.EUREKA loves to switch things up so we created this flavor! Each season will be a new seasonal flavor. Put your tastebuds to the test and see if you can guess what delicious flavor we debut for each season! Our cannabis oil is 100% natural, pesticide-free, solvent-free, and never cut or altered with MCT, PG, VG or Vitamin E Acetate.""",92,60
Happy Camper - 1g - Vape,Holidav,Hybrid,Vaporizers,89%,$70.00 ,"Calm,happy,relaxed,energetic",Not Specified,"In the mountains, on the beach, or just in your backyard--any place is a good place to pitch a tent and build a fire. Happy Camper is the perfect vibe to roast while mellowing (see what we did there?).ABOUT THE HARDWARE: The H-bar hardware is USB-C rechargeable and has a window for oil visibility. The compact design of the H-bar fits in the palm of your hand and can be comfortably placed in your pocket. Holiday distillate vapes are flavored with high-quality botanical terpenes.",89,70
Airplane Mode | 1g,Holiday,Hybrid,Vaporizers,62%,$70.00 ,"Calm,Happy,Relaxed,Energetic",Not Specified,?Kick off your shoes and reach for noise-cancelling headphones as you set your surroundings to Airplane Mode.Mind-calming CBG provides relaxation to the muscles while you kick-back.ABOUT THE HARDWARE: The H-bar hardware is USB-C rechargeable and has a window for oil visibility. The compact design of the H-bar fits in the palm of your hand and can be comfortably placed in your pocket. Holiday distillate vapes are flavored with high-quality botanical terpenes.?,62,70
