Strain,Company,Types,Categories,THC level,Price,Feelings,Flavor,Description,THC level numeric,Price numeric
Honey Banana | Live Resin,MFNY,Hybrid,Vaporizers,80.76%,$48.00 ,"Happy,Giggly,Uplifted","honey,tree fruit,sweet",Honey Bananas from Elemental Seeds is a heavy-handed hybrid strain bred from Strawberry Banana and Honey Boo Boo. This cannabis strain earns its name with a resinous coat as sticky as honey and an unmistakable banana aroma. She tends to provide weighty full-body effects coupled with an invigorating buzz of cerebral euphoria.,80,48
Rated R | Vape | Live Rosin | 0.5g,Rezinators,Hybrid,Vaporizers,65.00%,$55.00 ,"Focused,Relaxed,Euphoric","peach,mint,citrus","Rated R is a hybrid weed strain made from a genetic cross between Banana OG and Mimosa V6. This strain is 60% sativa and 40% indica. Rated R is a balanced and versatile hybrid that offers a diverse range of effects and flavors. Rated R typically contains around 20-24% THC, making it an ideal choice for experienced cannabis consumers who appreciate a well-rounded and potent strain. Leafly customers report that Rated R effects include feeling relaxed, euphoric, and happy, making it suitable for both relaxation and enhancing mood. Medical marijuana patients often choose Rated R when dealing with symptoms associated with chronic pain, anxiety, and depression, as it can provide soothing relief and promote a sense of well-being. Bred by Symbiotic Genetics, Rated R features flavors like sweet and earthy notes, hints of mint, and a touch of citrus, creating a complex and enjoyable taste profile. The dominant terpene of this strain is caryophyllene, which contributes to its earthy aroma and potential pain-relieving properties. The average price of Rated R typically ranges from $10-$16 per gram, offering a reasonably priced option for those seeking a balanced and flavorful cannabis strain. Rated R is a versatile and enjoyable hybrid strain that caters to a wide range of cannabis enthusiasts. If you?ve smoked, dabbed, or consumed Rated R, tell us about your experience by leaving a strain review.",65,55
Cherry Gelato | Live Resin | Ready To Use | 1g,Rove,Hybrid,Vaporizers,92.60%,$95.00 ,"Relaxed,Hungry,Euphoric","berry,sweet,tropical","Cherry Gelato, also known as ""Cherrylato"", is a hybrid weed strain (60% sativa & 40% indica) made by crossing Black Cherry Funk with Acai. The effects of Cherry Gelato are more calming than energizing. Consumers who have smoked this strain say it makes them feel euphoric, relaxed and creative. Cherry Gelato is best enjoyed during the afternoon or evening hours and pairs well with activities that require creative thought. In terms of flavor, you can expect sweet flavor combinations of tropical berries. One reviewer on Leafly dubbed Cherry Gelato as ?one of the best highs? they have ever had. The dominant terpene in this strain is Pinene, followed by Caryophyllene and Limonene. The original breeder of this strain is unknown.",92,95
Pineapple Express | Live Resin | Ready To Use | 1g,Rove,Hybrid,Vaporizers,92.60%,$95.00 ,"Calm,happy,relaxed,Energetic",Not Specified,"Buckle up for a heady trip across the pacific. Pineapple Express provides a blast of energy, promotes focused awareness and increases that quintessentially-coastal feeling of creativity. Got a best friend (or maybe dealer) you wanna share with? This hybrid is a great group activity with the perfect amount of THC to make you feel buzzed, alert and ready for an adventure. A slightly tropical taste of pineapple gives this strain its sun-kissed sweetness.Tastes: Pineapple, Earthy, Piney Terpenes: Myrcene, Caryophyllene, Limonene Effects/ Relief: Pain, Creative, Anxiety Lineage: Trainwreck x Hawaiian",92,95
Space Jam | Live Resin Disposable,To The Moon,Hybrid,Vaporizers,87.16%,$80.00 ,"Euphoric,Focused,Hungry","apricot,mint,tea","Disposable vaporizers contain concentrated cannabis oil that is heated by an attached battery and inhaled. These products come charged and ready to go, and are not designed to be reused, refilled, or recharged. These products are often very potent and are designed to be consumed in 2-3 second puffs.",87,80
Lemon Cherry Gelato | Disposable | Live Resin | 1.0g,To The Moon,Hybrid,Vaporizers,89.65%,$80.00 ,"Euphoric,Focused,Hungry",Not Specified,"Disposable vaporizers contain concentrated cannabis oil that is heated by an attached battery and inhaled. These products come charged and ready to go, and are not designed to be reused, refilled, or recharged. These products are often very potent and are designed to be consumed in 2-3 second puffs.",89,80
Pink Ztarburst | Disposable | Live Resin | 1.0g,To The Moon,Hybrid,Vaporizers,87.67%,$80.00 ,"Euphoric,Focused,Hungry",Not Specified,"Disposable vaporizers contain concentrated cannabis oil that is heated by an attached battery and inhaled. These products come charged and ready to go, and are not designed to be reused, refilled, or recharged. These products are often very potent and are designed to be consumed in 2-3 second puffs.",87,80
Cherry Bomb | Disposable | Live Resin | 1.0g,To The Moon,Hybrid,Vaporizers,86.41%,$80.00 ,"Euphoric,Focused,Hungry",Not Specified,"Disposable vaporizers contain concentrated cannabis oil that is heated by an attached battery and inhaled. These products come charged and ready to go, and are not designed to be reused, refilled, or recharged. These products are often very potent and are designed to be consumed in 2-3 second puffs.",86,80
Animal Mints | POD | 1g,Plug Play,Hybrid,Vaporizers,91%,$70.00 ,Relaxed,Not Specified,"Let your wild side out with our newest addition to our DNA line. Your mind and body will unwind thanks to the calming effects of Animal Mintz with an aftertaste that is faintly minty and is both sweet and pungent. Known to provide exhilaration while lowering tension, stress and pain.",928,70
Melon Dew | Exotics | POD | 1g,Plug Play,Hybrid,Vaporizers,91.24%,$70.00 ,Happy,Not Specified,Cannabis vaporizers are a great way to consume discreetly and consistently. Vape cartridges contain concentrated cannabis oil that is heated by a battery and vaporized for inhalation. These products are very potent and are designed to be consumed in 2-3 second puffs.,91,70
Peach Ringz | Exotics | POD | 1g,Plug Play,Hybrid,Vaporizers,88.36%,$70.00 ,Happy,Not Specified,Cannabis vaporizers are a great way to consume discreetly and consistently. Vape cartridges contain concentrated cannabis oil that is heated by a battery and vaporized for inhalation. These products are very potent and are designed to be consumed in 2-3 second puffs.,88,70
Melon Dew | Exotics | POD | 1g,Plug Play,Hybrid,Vaporizers,91.24%,$70.00 ,Happy,Not Specified,Cannabis vaporizers are a great way to consume discreetly and consistently. Vape cartridges contain concentrated cannabis oil that is heated by a battery and vaporized for inhalation. These products are very potent and are designed to be consumed in 2-3 second puffs.,91,70
Berkshire Roots | Dark belgian style | 100mg,Berkshire Roots,Hybrid,Tincture,100mg,$32.00 ,"Inspired,Happy,Uplifted",Not Specified,"Edibles are created either by infusing cooking oil or butter with cannabis extract, or by mixing extract directly into other ingredients. Because edibles are digested and absorbed by your stomach and liver, the activation is often longer than other consumption methods, taking on average 45 minutes, and sometimes up to 2 hours. It is important to start low and slow when consuming edibles so you don't over do it. Take extra caution to ensure edibles are out of the reach of children.",100,32
Sleep | Tablets | 20 Pack,1906,Indica,Edibles,100mg,$35.00 ,"Sleepy,Calm",Not Specified,"SLEEP combines full-spectrum cannabis oil (RSO indica), CBD, and CBN to stand out as a fast-acting, effective and health-conscious choice for those seeking an improved sleep experience. Like all 1906 Drops, it?s fast-acting, sugar-free, calorie-free, gluten-free and vegan.",100,35
Sleep | Tablets | 2 Pack,1906,Indica,Edibles,100mg,$4.00 ,"Sleepy,Calm",Not Specified,"SLEEP combines full-spectrum cannabis oil (RSO indica), CBD, and CBN to stand out as a fast-acting, effective and health-conscious choice for those seeking an improved sleep experience. Like all 1906 Drops, it?s fast-acting, sugar-free, calorie-free, gluten-free and vegan.",100,4
Dreamberry | 100mg,Jaunty,Indica,Edibles,100mg,$24.00 ,"Relaxed,Sleepy,Happy",Not Specified,Need a little rest and relaxation? Wind down your day with Jaunty?s Snoozeberry gummies! Each piece comes formulated with 10mg THC and 10mg CBN for the perfect nighttime treat. Sweet dreams...,100,24
Pineapple x Dosidos x Zkittles | Rosin Gummies,MFNY,Indica,Edibles,100mg,$30.00 ,"Relaxed,Sleepy,Happy",Not Specified,"These palate-pleasing Pineapple Fritter gummies are unlike any other edibles you've tried. Our vegan, full-spectrum gummies are infused with MFNY?s premium Apple Fritter live rosin extract. Superior to distillate, live rosin is made via solventless extraction from premium fresh frozen plants, preserving all the natural terpenes and tantalizing earthy flavors of the Apple Fritter strain, paired with the natural flavor of pineapple.",N/A,30
Offline | 100mg,Off Hours,Indica,Edibles,100mg,$30.00 ,"Relaxed,Sleepy,Happy",Not Specified,"OFF HOURS GRAPE PUNCH FLAVORED GUMMIES ARE SPECIALLY FORMULATED WITH THE PERFECT COMBINATION OF THC, CBN, AND CBD TO SEND YOU FAST ASLEEP. SWEET DREAMS. NANO-ENHANCED CANNABINOIDS FOR FAST ONSET. VEGAN FRIENDLY AND GLUTEN FREE.",100,30
Midnight Blueberry 5:1 | Camino | Sleep | 100mg,Kiva,Indica,Edibles,100mg,$33.00 ,"Sleepy,Relaxed",Not Specified,"Our top-selling product - and for a reason. Settle in for a smooth slumber by a serene lake and let all your worries go. This calming combination of THC, CBN, and relaxing, indica-like terpenes pair with chamomile and lavender extracts to promote restful sleep.",100,33
TTM | Pluto Punch | 100mg,To The Moon,Indica,Edibles,100mg,$30.00 ,"Relaxed,Sleepy,Happy,Calm,Clear mind",Not Specified,"Edibles are created either by infusing cooking oil or butter with cannabis extract, or by mixing extract directly into other ingredients. Because edibles are digested and absorbed by your stomach and liver, the activation is often longer than other consumption methods, taking on average 45 minutes, and sometimes up to 2 hours. It is important to start low and slow when consuming edibles so you don't over do it. Take extra caution to ensure edibles are out of the reach of children.",100,30
TTM | Cherry Nova | 100mg,To The Moon,Indica,Edibles,100mg,$30.00 ,"Happy,Relaxed,Sleepy",Not Specified,"Edibles are created either by infusing cooking oil or butter with cannabis extract, or by mixing extract directly into other ingredients. Because edibles are digested and absorbed by your stomach and liver, the activation is often longer than other consumption methods, taking on average 45 minutes, and sometimes up to 2 hours. It is important to start low and slow when consuming edibles so you don't over do it. Take extra caution to ensure edibles are out of the reach of children.",100,30
Hindu Kush | Jar ,Dank,Indica,Flower,29.10%,$53.00 ,"Relaxed,Sleepy,Happy",Not Specified,Dried cannabis flower is primarily ingested via inhalation. Activation time is roughly about 5 minutes and can last up to a few hours.,29,53
Benzina,Florist Farms,Indica,Flower,26%,$70.00 ,"Relaxed,Sleepy,Happy",Not Specified,ABOUT:Each jar contains a quarter ounce (7g) of flower.AROMA/FLAVOR Diesel forward with spicy and herbal undertones.,26,70
Dynamite Cookies,Tyson 2.0,Indica,Flower,24%,$44.00 ,"Happy,Relaxed,Sleepy",Not Specified,"Whether you?re looking to be the next heavyweight champion, or just conquer your morning routine, this strain will help you be like Mike. Testing at over 25% THC, this potent hybrid will get you ready to take on the world, and keep you relaxed throughout the day. This strain explodes with a classic cookie flavor, followed by diesel undertones, and a spicy exhale. Light em up.",24,44
Tiger Mintz,Tyson 2.0,Indica,Flower,25%,$44.00 ,"Relaxed,Sleepy,Happy,Focused",Not Specified,"It?s no surprise that this refreshing strain packs a punch. Weighing in at just under 31% THC, this heavy-hitting indica-dominant will leave you seeing stars, laid out with tingly waves of euphoria. It has a crisp mint and diesel aroma, with sweet berry and sour cherry flavors, making this Mike?s preferred dessert strain.",25,44
Orange Zkittlez | Moonrocks,Veterans Choice Creations,Indica,Flower,53%,$66.00 ,"Relaxed,Sleepy,Happy",Not Specified,"Each bag of SPACEBUDS Moonrocks carries 4 grams of celestial joy. We start with nuggets of our Mandarin Zkittlez flower, then we drench them in our premium Hash Rosin. But we don't stop there; we add a proprietary mix of terpenes to turbocharge the flavor to stellar proportions. Finally, each nugget is tossed and coated in powdered hash, amplifying the taste and texture to galactic levels.The result? Moonrocks that boast an out-of-this-world over 42% Total Cannabinoids including over 37% THC. These aren't your everyday cannabis product - they're a spectacular shooting star of pleasure, designed to make every moment feel like a cosmic celebration.",53,66
Purple Daddy,Zizzle,Indica,Flower,17.60%,$47.00 ,"Happy,Relaxed,Sleepy",Not Specified,"Purple Daddy is an indica-dominant hybrid strain of cannabis that is known for its relaxing effects and sweet, fruity flavor. It is a cross be- tween Granddaddy Purple and Sugar Daddy and is often used to alleviate symptoms of anxiety, depression, and chronic pain. Purple Daddy typical- ly has a deep purple color, with medium to large-sized buds and a dense, sticky texture. It has a sweet and fruity aroma, with hints of grape, berry, and candy. The high from Purple Daddy is usually not too overpowering, making it a good choice for novice cannabis users, and",17,47
Triple Infused | RuntzxZoap | 5pk |Tidal Waves | 0.5g,7 SEAZ,Indica,Pre-rolls,31.39%,$55.00 ,"Focused,Happy,Relaxed,Energetic,Inspired,Uplifted",Not Specified,"Rolled up and ready to smoke, Pre-Rolls are a convenient and effective way to consume cannabis. Pre-Rolls come in many different forms and can be rolled with flower, shake, ""b-buds"", infused with concentrates, and more.",31,55
NYC Diesel | Infused | 6 Pack,Animal,Indica,Pre-rolls,37.06%,$65.00 ,"Relaxed,Sleepy,Happy",Not Specified,"SUPER INFUSED with highly potent diamonds, cannabis oil, terpenes, and kief.Premium whole flower, never trim or shake, and always hand-rolled.Hand rolled and kief coated. The pungent, gassy flavors of the legendary New York Diesel promise to keep you uplifted and energetic while you weave your way through the concrete jungle.",37,65
Headhunter | 1g,Bannermans Batch,Indica,Pre-rolls,18%,$12.00 ,"Relaxed,Sleepy,Happy",Not Specified,"Rolled up and ready to smoke, Pre-Rolls are a convenient and effective way to consume cannabis. Pre-Rolls come in many different forms and can be rolled with flower, shake, ""b-buds"", infused with concentrates, and more.",18,12
Stellar OG | 1g,Bannermans Batch,Indica,Pre-rolls,18-20%,$12.00 ,"Relaxed,Sleepy,Happy",Not Specified,"Rolled up and ready to smoke, Pre-Rolls are a convenient and effective way to consume cannabis. Pre-Rolls come in many different forms and can be rolled with flower, shake, ""b-buds"", infused with concentrates, and more.",18,12
Lucys | Diamond Infused | Slurricane | 3 Pack,Blotter,Indica,Pre-rolls,54%,$56.00 ,"Focused,Happy,Relaxed,Energetic,Inspired,Uplifted",Not Specified,"Slurricane is sweet with notes of grape and berries.Blotter Lucys start with top-quality flower picked at its peak. These Lucys have been infused with pure THC diamonds throught indica-dominant flower, with pure cannabis oil painted on the paper and then rolled in kief, packing a powerful punch and coming in at a heft 54% THC overall. The result is a blend of crystals and terpenes that deliver a flavorful and full-bodied experience, true to the strain. Lucys prerolls are great for those looking to explore the unique flavor profiles of both flower and concentrate. Blotter is grown and extracted in Cortland, New York by a team of passionate farmers and extractors.",54,56
Wedding Cake,Cornucopia,Indica,Pre-rolls,19%,$12.00 ,"Relaxed,Aroused,Hungry","Vanilla,pepper,sweet","Wedding Cake, also known as ""Triangle Mints #23,"" is a potent type of indica-hybrid marijuana strain made by crossing Triangle Kush with Animal Mints. Fun fact: In Canada, this strain is known as Pink Cookies. The Wedding Cake strain provides relaxing and euphoric effects that calm the body and mind. This strain yields a rich and tangy flavor profile with undertones of earthy pepper. Medical marijuana patients choose Wedding Cake to help relieve symptoms associated with pain, insomnia and appetite loss. Consumers with a low THC tolerance should enjoy this strain with an extra slice of care due to its high THC content. Wedding Cake has soared in popularity over the years and was named Leafly Strain of the Year in 2019.",19,12
Northern Lights,Cornucopia,Indica,Pre-rolls,20%,$12.00 ,"Sleepy,Hungry,Relaxed","pine,spicy herbal,earthy","Northern Lights, also known as ""NL,"" is an indica marijuana strain made by crossing Afghani with Thai. Northern Lights produces euphoric effects that settle in firmly throughout the body, relaxing muscles and easing the mind. Consumers say this strain has a pungently sweet and spicy flavor profile that is smooth on the exhale. Medical marijuana patients choose Northern Lights to help relieve symptoms associated with depression, stress, pain and insomnia. Growers say this strain features purple and crystal-coated buds and grows best indoors with a flowering time of 45-50 days.Northern Lights stands among the most famous strains of all time, a pure indica cherished for its resinous buds, fast flowering, and resilience during growth. This strain has given rise to famous hybrids like Shiva Skunk and Super Silver Haze. Rumor has it that Northern Lights first sprouted near Seattle, Washington, but was propagated out of Holland after 1985 at what is now Sensi Seeds.",20,12
Runtz Ether | Joint | 1g,Dank,Indica,Pre-rolls,30.84%,$17.00 ,"Relaxed,Sleepy,Happy",Not Specified,"One gram of our potent, fan-favorite Runtz Ether flower rolled into a fresh hemp wrap. Runtz Ether is a hybrid strain with exceptionally high potency. A cross of of Chemdawg x Alien Technology. It has a high which is both euphoric and relaxing, which is typical of most hybrids. Many note that this strain is good for relieving stress, anxiety, and chronic pain. Enjoy Responsibly!",30,17
Skunk x Northern Lights,Harvest,Indica,Pre-rolls,21.73%,$14.00 ,"Relaxed,Sleepy,Focused,Happy",Not Specified,"Skunk x Northern Lights is a balanced blend of both indica and sativa characteristics. A relaxing body high combined with uplifting and euphoric cerebral effects, this strain may promote feelings of happiness, creativity, and relaxation while alleviating stress, pain, and insomnia.",21,14
Skywalker OG | 1g,Harvest,Indica,Pre-rolls,24.46%,$44.00 ,"Sleepy,Relaxed,Tingly","spicy herbal,pungent,earthy","Skywalker OG is an Indica-dominant hybrid cannabis strain with a potent THC content ranging from 20% to 30%. It is a cross between Mazar and Blueberry OG strains. The dominant terpenes found in Skywalker OG are myrcene, caryophyllene, and limonene. Skywalker OG is well-known for its relaxing and euphoric effects, making it an excellent choice for stress relief and pain management. This strain is often used to alleviate symptoms of anxiety, depression, and insomnia. The strain's name pays homage to the Star Wars franchise, featuring the namesake of Luke Skywalker himself. Skywalker OG's creators chose to name the strain after the Jedi hero due to its potent, ""forceful"" effects. When it comes to taste and aroma, Skywalker OG has a spicy, herbal flavor with hints of earthy undertones. The top flavors and aromas include diesel, pine, and spicy herbal notes.As for Luke Skywalker, well, we can only imagine him toking up on some Skywalker OG after a long day of fighting the dark side. Perhaps it's even what helped him stay so calm during those intense lightsaber battles. Who knows, maybe Yoda was growing Skywalker OG on Dagobah all along!",24,44
Blueberry Muffin,MFNY,Indica,Pre-rolls,31.30%,$20.00 ,"Relaxed,Tingly,Happy","blueberry,butter,vanilla","Blueberry Muffin, also known as ""Blueberry Muffins,"" is an indica-dominant hybrid marijuana strain made from a cross of Blueberry and Purple Panty Dropper. Produced by Humboldt Seed Co., Blueberry Muffin is revered for its uniform bud structure and purple-tinted flowers. This strain features a flavor profile that smells like a tray of fresh baked muffins. Blueberry Muffin's sweetness is softened by a smooth, creamy finish and makes for a tasty joint. ",31,20
Gazzurple | Infused,MFNY,Indica,Pre-rolls,33.57%,$20.00 ,"Relaxed,Sleepy,Happy",Not Specified,"For our kief infused pre-rolls, we start with premium, hand-trimmed whole Gazzurple flower then pass it through a micro filter. This process creates dry sift that retains high potency and results in a more enhanced flavor experience of the Gazzurple strain. With a distinct scent and taste of berries, cream, and that classic gas, it offers an excellent type of high. Exclusively single-sourced at MFNY in the Hudson Valley.",33,20
Blueberry Muffin | Live Resin,MFNY,Indica,Pre-rolls,48.43%,$48.00 ,"Relaxed,Tingly,Happy","blueberry,butter,vanilla","Blueberry Muffin, also known as ""Blueberry Muffins,"" is an indica-dominant hybrid marijuana strain made from a cross of Blueberry and Purple Panty Dropper. Produced by Humboldt Seed Co., Blueberry Muffin is revered for its uniform bud structure and purple-tinted flowers. This strain features a flavor profile that smells like a tray of fresh baked muffins. Blueberry Muffin's sweetness is softened by a smooth, creamy finish and makes for a tasty joint. ",48,48
WAP | 3 Pack,Zizzle,Indica,Pre-rolls,25%,$27.00 ,"Relaxed,Sleepy,Happy",Not Specified,"WAP is a cross between Cheetah Piss and Project 4516, a hard hitting indica dominant hybrid with higher CBD content. It has a fruity, piney and floral scent and flavor, and a euphoric, relaxing and sleepy effect.Proudly serving the Binghamton, Johnson City, Endicott, and Owego area in New York!",25,27
Apple Fritter | AIO,ayrloom,Indica,Vaporizers,90%,$35.00 ,"Aroused,Sleepy,Relaxed","rose,flowery,lavender","Pink Rozay is a potent indica marijuana strain bred by Cookies. Pink Rozay is inspired by the bright, floral flavors you often find when drinking a class of rose - but without the hangover. Smoking Pink Rozay will give you a heavy head high but your body will feel at ease. Because this strain is known to be high in THC, it is important to enjoy in small quantities. Pink Rozay nugs are frosty with muted shades of green and orange. Medical marijuana patients choose this strain to help relieve symptoms related to chronic pain.",90,35
Tahoe | Cart,ayrloom,Indica,Vaporizers,90%,$60.00 ,"Happy,Focused",Not Specified,Earthy with just the right amount of citrus. There?s nothing subtle about our twist on this classic.,90,60
Rest | Mood | AIO | (CBN),ayrloom,Indica,Vaporizers,75%,$35.00 ,"Relaxed,Sleepy,Happy",Not Specified,Cannabis vaporizers are a great way to consume discreetly and consistently. Vape cartridges contain concentrated cannabis oil that is heated by a battery and vaporized for inhalation. These products are very potent and are designed to be consumed in 2-3 second puffs.,75,35
Pink Rozay | AIO,ayrloom,Indica,Vaporizers,90%,$35.00 ,"Aroused,Sleepy,Relaxed","rose,flowery,lavender","Pink Rozay is a potent indica marijuana strain bred by Cookies. Pink Rozay is inspired by the bright, floral flavors you often find when drinking a class of rose - but without the hangover. Smoking Pink Rozay will give you a heavy head high but your body will feel at ease. Because this strain is known to be high in THC, it is important to enjoy in small quantities. Pink Rozay nugs are frosty with muted shades of green and orange. Medical marijuana patients choose this strain to help relieve symptoms related to chronic pain.",90,35
Forbidden Fruit | AIO | 1g,cannabals,Indica,Vaporizers,88%,$55.00 ,"Happy,Relaxed,Sleepy",Not Specified,"Don?t let our compact and discrete disposable hardware fool you, our state of the art custom Blinc AIO Simple vaporizer delivers one gram/ml of high potency indica cannabis oil with naturally derived Forbidden Fruit terpenes.",88,55
Sour Papaya | AIO | 1g,cannabals,Indica,Vaporizers,80.76%,$65.00 ,"Relaxed,Happy,Focused","peach,grapefruit,tropical",Sour Papaya is believed to be a hybrid marijuana strain. We're still learning about Sour Papaya and its effects.,80,65
Blackberry | Disposable | 0.5g,EUREKA,Indica,Vaporizers,87.46%,$40.00 ,"Relaxed,Sleepy,Happy",Not Specified,"The CLASSIC Blackberry Kush disposable brings you our pure & potent distillate in a convenient, rechargeable vape. Blackberry Kush produces relaxing effects & strong body high. Blackberry Kush offers a hashy flavor profile with a jet fuel taste and aroma balanced out with sweet berries. Our cannabis oil is 100% natural, pesticide-free, solvent-free, and never cut or altered with MCT, PG, VG or Vitamin E Acetate.""",87,40
Gorilla Glu | Vape | 0.5g,Gezoont,Indica,Vaporizers,83.99%,$35.00 ,"Relaxed,Sleepy,Happy",Not Specified,CO2 oil. We never use ethanol or any solvent other than CO2 in its creation. The devices are rechargeable and disposable.Total THC: 83.99%/419.93MG Total Cannabinoids: 89.56%/447.80mg Live Terpenes: 3.7%Beta-Myrcene (anti-inflammatory)Beta-Caryophyllene (pain management)Limonene (stress relief),83,35
