Strain,Company,Types,Categories,THC level,Price,Feelings,Flavor,Description,THC level numeric,Price numeric
Bubble Hash,Hepworth,Hybrid,Concentrates,33.30%,$18.00 ,"Focused,Happy,Relaxed,Energetic,Inspired,Uplifted",Not Specified,"Rolled up and ready to smoke, Pre-Roll packs are a convenient and effective way to consume cannabis. Pre-Roll packs generally contain smaller pre-rolls so that each can be consumed in one sitting.",33,18
Frosted Hash Ball,Silly Nice,Hybrid,Concentrates,50%,$50.00 ,"Energetic,Happy,Relaxed,Calm",Not Specified,"Indulge in the epitome of cannabis luxury with our exquisite 1-gram Frosted Hash Ball. Meticulously handcrafted using artisanal techniques, this hash is a testament to unparalleled quality and craftsmanship. Imbued with a full spectrum of cannabinoids, it delivers a rich and robust high that captivates the senses and elevates the experience to new heights.With a potency boasting an impressive 50% THC content, our Frosted Hash Ball offers a potent and powerful journey for cannabis enthusiasts seeking the ultimate in intoxicating bliss. Each puff promises to envelop you in a blanket of euphoria and relaxation, transporting you to a state of pure bliss and tranquility.Whether you're a seasoned connoisseur or a curious newcomer, our Frosted Hash Ball invites you to embark on a journey of exploration and discovery. Savor the richness of its flavor profile, with nuanced notes of earthiness and spice dancing on the palate with every inhale.Elevate your cannabis experience with Silly Nice's Frosted Hash Ball?a true embodiment of luxury and refinement in every puff.",50,50
THCa Diamond Powder | 0.5g,Silly Nice,Hybrid,Concentrates,84%,$44.00 ,Happy,Not Specified,"Unlock a new dimension of potency with Silly Nice Diamond Powder. This isn't just another concentrate; it's a revolution in purity and strength, crafted for those who demand the best. Manufactured by Veterans Holdings in Gloversville, NY, Diamond Powder takes the throne as the pinnacle of THCa crystals, setting new industry standards.**THCa Explained**THCa stands for Tetrahydrocannabinolic acid - the non-psychoactive hero in raw cannabis. Unlike its famous cousin THC, THCa doesn't get you high until it's heated. When you blaze or bake it, THCa transforms into THC, offering you potency like never before. It's the core of what makes Silly Nice Diamond Powder a game-changer for enthusiasts seeking a pure, intense experience.**Potency & Purity**With a stunning 96.03% THCa and total THC hitting the 84.48% mark, Diamond Powder is a titan of potency. It's all about the raw power of cannabis, stripped down to its most potent form. Silly Nice ensures what you get is all killer, no filler ? just unmatched clarity and strength in every granule.**How to Elevate Your Game**- **Joints, Bowls, Bongs:** Spark up your flower game by sprinkling Diamond Powder into your smoke. It's an instant upgrade, transforming ordinary sessions into extraordinary escapes.- **Dabbing & Vaporizing:** Dive deep into flavor and effects with a dab rig or vape. Diamond Powder delivers a clean, intense hit that's all about the pure THCa experience.- **Edibles & Topicals:** Get creative in the kitchen or with your self-care routine. Heating turns THCa into THC, infusing edibles with unmatched potency, while topical application explores THCa's therapeutic side.**Quality Without Compromise**Every batch from Veterans Holdings meets rigorous testing standards, ensuring that Silly Nice Diamond Powder is not only potent but also pure and safe. It's a commitment to excellence that you can see, smell, and feel.Silly Nice isn't just a brand; it's a statement. With Diamond Powder, we invite you to go beyond the ordinary and explore the extraordinary possibilities of cannabis. Whether you're rolling it, dabbing it, or infusing it, prepare for an experience that redefines the limits of potency and purity.**Dare to Discover**Silly Nice Diamond Powder is more than a product. It's a journey to the essence of what cannabis can be. Made for those who aren't afraid to push boundaries and explore the heights of what cannabis concentrates can offer. Welcome to the future of cannabis with Silly Ni",84,44
Frosted Hash Ball | 1g,Silly Nice,Hybrid,Concentrates,50%,$50.00 ,Relaxed,Not Specified,"Overview: The Frosted Hash Ball is the pinnacle of innovation from Silly Nice, brought to you by Jason Ambrosino, the industry maverick behind Veteran Holdings. Utilizing expertise honed at the forefront of cannabis processing and manufacturing, this concentrate is derived from select 45-160 micron bubble hash, made using fresh frozen material from Full Spectrum Ag. Each hash ball is hand coated in THCA isolate, resulting in a oogle worthy frosted appearance. This unique process enhances the potency, allowing for a deep and immersive experience, sometimes allowing the resin to fully absorb the powder for an unmatched potency profile.Potency:Total Cannabinoids: 55.63% (556.3 mg/g)Total THC: 49.62% (496.2 mg/g)Total CBD: 0.07585% (0.7585 mg/g)Terpene Profile and Effects: The Frosted Hash Ball boasts an intricate terpene profile, carefully curated to offer a symphony of effects and flavors:Beta-caryophyllene (0.8854%): A spicy, peppery essence that contributes to stress relief and anxiety reduction.Limonene (0.7012%): A burst of citrus to elevate mood and alleviate stress.Ocimene (0.3683%): Sweet, herbaceous undertones for an uplifting effect.Terpinolene (0.2777%): A harmonious blend of pine, floral, and citrus, promoting relaxation and sleep.Together, these terpenes craft a rich, balanced effect that is simultaneously relaxing and euphoric, with a flavor profile that skillfully balances spicy, citrus, and earthy tones.Quality Assurance: Rigorously tested for potency and terpene content, the Frosted Hash Ball meets the highest standards of quality and safety. Our commitment to excellence ensures each batch is free from microbial contamination, heavy metals, and residual solvents, offering you a pure and potent product.Usage Instructions: Due to its high potency, the Frosted Hash Ball is recommended for those with experience in cannabis concentrates. It can be enjoyed in small quantities either by itself or complementing flower in a bowl, joint, or vaporizer. Start with a small amount to gauge its potent effects.",50,50
Grapefruit | 1:1 | Single,ayrloom,Hybrid,Drink,20mg,$3.50 ,"Calm,Happy,Relaxed,Energetic",Not Specified,"Classic Grapefruit flavor, but make it pink! The perfectly balanced combination of sweet and tart, it?ll leave you (and your taste buds) uber refreshed. Fast Acting, Gluten Free, Vegan.",20,3.5
Pineapple Mango | 1:1 | Single,ayrloom,Hybrid,Drink,20mg,$3.50 ,"Calm,Happy,Relaxed,Energetic",Not Specified,"Classic Grapefruit flavor, but make it pink! The perfectly balanced combination of sweet and tart, it?ll leave you (and your taste buds) uber refreshed. Fast Acting, Gluten Free, Vegan.",20,3.5
Black Cherry | UP | Single,ayrloom,Hybrid,Drink,20mg,$5.00 ,"Relaxed,Happy,Calm,Energetic",Not Specified,"Electrifyingly crisp and slightly tart. Unexpectedly smooth and never too sweet, it packs a flavor punch with every sip! Fast Acting Gluten Free, Vegan",20,5
Lemonade | UP | Single,ayrloom,Hybrid,Drink,20mg,$5.00 ,"Calm,Happy,Relaxed,Energetic",Not Specified,"INGREDIENTS FILTERED WATER, SUGAR, LEMON JUICE CONCENTRATE, NATURAL FLAVORS, CANNABIS EXTRACT, POTASSIUM SORBATE (PRESERVATIVE), ASCORBIC ACID.",20,5
Honeycrisp | UP | Single,ayrloom,Hybrid,Drink,10mg,$5.00 ,"Energetic,Happy,Calm,Relaxed",Not Specified,"As each day shortens, the signs of fall settle in. Green leaves shift to crimson and gold, evenings get brisk, and apples plump on their tree branches.",10,5
Half & Half | UP | 2:1 | Single | 10mg,ayrloom,Hybrid,Drink,10mg,$4.50 ,Happy,Not Specified,"A hole in one that would make arnie proud. half lemonade, half tea, this delightfully refreshing beverage is steeped in rich tradition.",10,4.5
Spiced Apple UP | 2:1,ayrloom,Hybrid,Drink,100mg,$30.00 ,"Calm,Happy,Relaxed,Energetic",Not Specified,"Enjoy uplifting sensory effects with sweet, citrusy pink lemonade flavors. refresh + invigorate with an inspiring combination of THC + CBC to help foster a creative mood boost, perfect for an afternoon pick-me-up.INGREDIENTS TAPIOCA SYRUP, CANE SUGAR, PECTIN, NATURAL FLAVORS, CITRIC ACID, SODIUM CITRATE, CANNABIS EXTRACT, NATURAL COLORS (FROM FRUIT AND VEGETABLE EXTRACTS)INSTRUCTIONS TAKE 1 GUMMY AND WAIT AT LEAST 1 HOUR TO FEEL EFFECT BEFORE CONSUMING MORE. STORE IN A COOL, DRY PLACE.",100,30
Sugar Plum UP | 2:1,ayrloom,Hybrid,Drink,100mg,$30.00 ,"Calm,Happy,Relaxed,Energetic",Not Specified,"Enjoy uplifting sensory effects with sweet, citrusy pink lemonade flavors. refresh + invigorate with an inspiring combination of THC + CBC to help foster a creative mood boost, perfect for an afternoon pick-me-up.INGREDIENTS TAPIOCA SYRUP, CANE SUGAR, PECTIN, NATURAL FLAVORS, CITRIC ACID, SODIUM CITRATE, CANNABIS EXTRACT, NATURAL COLORS (FROM FRUIT AND VEGETABLE EXTRACTS)INSTRUCTIONS TAKE 1 GUMMY AND WAIT AT LEAST 1 HOUR TO FEEL EFFECT BEFORE CONSUMING MORE. STORE IN A COOL, DRY PLACE.",100,30
Sunny Days Gummies,ayrloom,Hybrid,Drink,100mg,$30.00 ,"Calm,Happy,Relaxed,Energetic",Not Specified,"Enjoy uplifting sensory effects with sweet, citrusy pink lemonade flavors. refresh + invigorate with an inspiring combination of THC + CBC to help foster a creative mood boost, perfect for an afternoon pick-me-up.INGREDIENTS TAPIOCA SYRUP, CANE SUGAR, PECTIN, NATURAL FLAVORS, CITRIC ACID, SODIUM CITRATE, CANNABIS EXTRACT, NATURAL COLORS (FROM FRUIT AND VEGETABLE EXTRACTS)INSTRUCTIONS TAKE 1 GUMMY AND WAIT AT LEAST 1 HOUR TO FEEL EFFECT BEFORE CONSUMING MORE. STORE IN A COOL, DRY PLACE.",100,30
Sunny Days Pink Lemonade UP | 2:1,ayrloom,Hybrid,Drink,100mg,$30.00 ,"Calm,Happy,Relaxed,Energetic",Not Specified,"Enjoy uplifting sensory effects with sweet, citrusy pink lemonade flavors. refresh + invigorate with an inspiring combination of THC + CBC to help foster a creative mood boost, perfect for an afternoon pick-me-up.INGREDIENTS TAPIOCA SYRUP, CANE SUGAR, PECTIN, NATURAL FLAVORS, CITRIC ACID, SODIUM CITRATE, CANNABIS EXTRACT, NATURAL COLORS (FROM FRUIT AND VEGETABLE EXTRACTS)INSTRUCTIONS TAKE 1 GUMMY AND WAIT AT LEAST 1 HOUR TO FEEL EFFECT BEFORE CONSUMING MORE. STORE IN A COOL, DRY PLACE.",100,30
Pillow Talk UP | 2:1,ayrloom,Hybrid,Drink,100mg,$30.00 ,"Calm,Happy,Relaxed,Energetic",Not Specified,"Enjoy uplifting sensory effects with sweet, citrusy pink lemonade flavors. refresh + invigorate with an inspiring combination of THC + CBC to help foster a creative mood boost, perfect for an afternoon pick-me-up.INGREDIENTS TAPIOCA SYRUP, CANE SUGAR, PECTIN, NATURAL FLAVORS, CITRIC ACID, SODIUM CITRATE, CANNABIS EXTRACT, NATURAL COLORS (FROM FRUIT AND VEGETABLE EXTRACTS)INSTRUCTIONS TAKE 1 GUMMY AND WAIT AT LEAST 1 HOUR TO FEEL EFFECT BEFORE CONSUMING MORE. STORE IN A COOL, DRY PLACE.",100,30
Orchard Sunrise UP | 2:1,ayrloom,Hybrid,Drink,100mg,$30.00 ,"Calm,Happy,Relaxed,Energetic",Not Specified,"Enjoy uplifting sensory effects with sweet, citrusy pink lemonade flavors. refresh + invigorate with an inspiring combination of THC + CBC to help foster a creative mood boost, perfect for an afternoon pick-me-up.INGREDIENTS TAPIOCA SYRUP, CANE SUGAR, PECTIN, NATURAL FLAVORS, CITRIC ACID, SODIUM CITRATE, CANNABIS EXTRACT, NATURAL COLORS (FROM FRUIT AND VEGETABLE EXTRACTS)INSTRUCTIONS TAKE 1 GUMMY AND WAIT AT LEAST 1 HOUR TO FEEL EFFECT BEFORE CONSUMING MORE. STORE IN A COOL, DRY PLACE.",100,30
Juicy Secret UP | 2:1,ayrloom,Hybrid,Drink,100mg,$30.00 ,"Calm,Happy,Relaxed,Energetic",Not Specified,"Enjoy uplifting sensory effects with sweet, citrusy pink lemonade flavors. refresh + invigorate with an inspiring combination of THC + CBC to help foster a creative mood boost, perfect for an afternoon pick-me-up.INGREDIENTS TAPIOCA SYRUP, CANE SUGAR, PECTIN, NATURAL FLAVORS, CITRIC ACID, SODIUM CITRATE, CANNABIS EXTRACT, NATURAL COLORS (FROM FRUIT AND VEGETABLE EXTRACTS)INSTRUCTIONS TAKE 1 GUMMY AND WAIT AT LEAST 1 HOUR TO FEEL EFFECT BEFORE CONSUMING MORE. STORE IN A COOL, DRY PLACE.",100,30
Restore Topical,ayrloom,Hybrid,Drink,1000mg,$55.00 ,Relaxed,Not Specified,"Restore is a 1000mg of THC : 1000mg of CBD whick includes ORGANIC REFINED SHEA BUTTER, ORGANIC COCONUT MCT OIL, ORGANIC BEESWAX, CANNABIS EXTRACT, ORGANIC LAVENDER ESSENTIAL OIL, ORGANIC EUCALYPTUS ESSENTIAL OIL, ORGANIC ROSEMARY ESSENTIAL OIL.",1000,55
Restore Topical,ayrloom,Hybrid,Drink,1000mg,$55.00 ,Relaxed,Not Specified,"Restore is a 1000mg of THC : 1000mg of CBD whick includes ORGANIC REFINED SHEA BUTTER, ORGANIC COCONUT MCT OIL, ORGANIC BEESWAX, CANNABIS EXTRACT, ORGANIC LAVENDER ESSENTIAL OIL, ORGANIC EUCALYPTUS ESSENTIAL OIL, ORGANIC ROSEMARY ESSENTIAL OIL.",1000,55
Milk Chocolate | Infused | 100mg,Hysteria,Hybrid,Edibles,70mg,$40.00 ,"Happy,Relaxed,Focused",mint,"melt-in-your-mouth, smooth, sophisticated finish is here to melt away tension and uplift your spirit with each bite. These innovative edibles are the perfect evening activity. Feel relaxed, calm, and allow your mind to unwind from daily stress.",70,40
Dark Chocolate | Infused | 100mg,Hysteria,Hybrid,Edibles,70mg,$40.00 ,"Calm,Happy,Relaxed,Energetic",Not Specified,"Our Classic Dark Chocolates are infused with 10mg THC per serving. Delicious, rich, melt-in-your-mouth, smooth, sophisticated finish is here to melt away tension and uplift your spirit with each bite. These innovative edibles are the perfect evening activity. Feel relaxed, calm, and allow your mind to unwind from daily stress",70,40
Cookies & Cream | Infused | 100mg,Hysteria,Hybrid,Edibles,100mg,$40.00 ,N/A,Not Specified,N/A,100,40
Strawberry x Honey Banana | Live Rosin Gummies,MFNY,Hybrid,Edibles,100mg,$30.00 ,"Calm,Happy,Relaxed,Energetic",Not Specified,"These palate-pleasing Strawberry Honey Banana gummies are unlike any other edibles you've tried. Our vegan, full-spectrum gummies are infused with MFNY?s premium Honey Banana live rosin extract. Superior to distillate, live rosin is made via solventless extraction from premium fresh frozen plants, preserving all the natural terpenes and dazzling sweet and fruity flavors of the Honey Banana strain, paired with the natural flavor of ripe strawberry.",100,30
Cherry x Poddy Mouth | Rosin Gummies,MFNY,Hybrid,Edibles,100mg,$30.00 ,"Calm,Energetic,Happy,Relaxed",Not Specified,"These palette-pleasing Cherry Mouth gummies are unlike any other edibles you've tried. Our vegan, full-spectrum gummies are infused with MFNY?s premium Poddy Mouth live rosin extract. Superior to distillate, live rosin is made via solventless extraction from premium fresh frozen plants, preserving all the natural terpenes and dazzling earthy and savory flavors of the Poddy Mouth strain, paired with the natural flavor of ripe cherry.",100,30
Watermelon Fritter | Rosin Gummies,MFNY,Hybrid,Edibles,100mg,$30.00 ,"Calm,Energetic,Happy,Telaxed",Not Specified,"These mouth-watering Watermelon Fritter gummies are unlike any other edibles you've tried. Our vegan, full-spectrum gummies are infused with MFNY?s premium Apple Fritter live rosin extract. Superior to distillate, live rosin is made via solventless extraction from premium fresh frozen plants, preserving all the natural terpenes and tantalizing earthy flavors of the Apple Fritter strain, paired with the natural flavor of watermelon.",100,30
Peach x Rainbow Beltz | Rosin Gummies | 50mg,MFNY,Hybrid,Edibles,100mg,$21.00 ,"Happy,Relaxed,Calm,Energetic",Not Specified,"These palate-pleasing Raspberry x Rainbow Beltz 2.0 gummies are unlike any other edibles you've tried. Our vegan, full-spectrum gummies are infused with MFNY?s premium Rainbow Beltz 2.0 live rosin extract. Superior to distillate, live rosin is made via solventless extraction from premium fresh frozen plants, preserving all the natural terpenes and dazzling sweet and fruity flavors of the Rainbow Beltz 2.0 strain, paired with the natural flavor of ripe raspberry.",100,21
Strawberry x Strawpaya | Rosin Gummies | 100mg,MFNY,Hybrid,Edibles,100mg,$21.00 ,"Happy,Relaxed,Calm,Energetic",Not Specified,"These palate-pleasing Raspberry x Rainbow Beltz 2.0 gummies are unlike any other edibles you've tried. Our vegan, full-spectrum gummies are infused with MFNY?s premium Rainbow Beltz 2.0 live rosin extract. Superior to distillate, live rosin is made via solventless extraction from premium fresh frozen plants, preserving all the natural terpenes and dazzling sweet and fruity flavors of the Rainbow Beltz 2.0 strain, paired with the natural flavor of ripe raspberry.",100,21
Blueberry x Oishii | Rosin Gummies | 100mg,MFNY,Hybrid,Edibles,100mg,$30.00 ,"Calm,Energetic,Happy,Telaxed",Not Specified,"These mouth-watering Watermelon Fritter gummies are unlike any other edibles you've tried. Our vegan, full-spectrum gummies are infused with MFNY?s premium Apple Fritter live rosin extract. Superior to distillate, live rosin is made via solventless extraction from premium fresh frozen plants, preserving all the natural terpenes and tantalizing earthy flavors of the Apple Fritter strain, paired with the natural flavor of watermelon.",100,30
Pink Lemonade | Rosin Gummies,MFNY,Hybrid,Edibles,100mg,$30.00 ,"Energetic,Focused,Uplifted","lemon,pepper,citrus","A must for edible lovers, these palate-pleasing Pink Lemonade x Lemoncane gummies are unlike any other edibles you've tried. Our vegan, full-spectrum, cultivar-specific gummies are infused with MFNY?s premium Lemoncane live rosin extract. Superior to distillate, live rosin is made via solventless extraction from premium fresh frozen plants, preserving all the natural terpenes. We use the minimum amount of sugar to highlight the spicy pineapple flavors of the Pinezapple, paired with natural flavors of pineapple.",100,30
Black Cherry | 10mg | Single Can,Tune,Hybrid,Edibles,10mg,$5.00 ,"Relaxed,Happy,Calm,Energetic",Not Specified,"10mg Infused Seltzer - Made with Real Juice - Sweetened with Honey - Low Calorie Get ready to tune in and soak up summer vibes with our Sicilian Lemon & Rose 10mg infused seltzer. We've taken classic lemonade and given it a fun twist with a hint of delicate rose. In each low-calorie can, you'll find 10mg of THC, real lemon juice, and a touch of honey. .",10,5
Sicilian Lemon & Rose | 10mg | Single Can,Tune,Hybrid,Edibles,10mg,$5.00 ,"Relaxed,Happy,Calm,Energetic",Not Specified,"10mg Infused Seltzer - Made with Real Juice - Sweetened with Honey - Low Calorie Get ready to tune in and soak up summer vibes with our Sicilian Lemon & Rose 10mg infused seltzer. We've taken classic lemonade and given it a fun twist with a hint of delicate rose. In each low-calorie can, you'll find 10mg of THC, real lemon juice, and a touch of honey. .",10,5
Blueberry Dreams | CBN | 100mg,Cannabals,Hybrid,Edibles,100mg,$22.00 ,"Energetic,Happy,Creative,Focused,Inspired,Calm",Not Specified,"Experience the incredible advantages of cannabis without delay with CANNABALS ""Cannabis you can eat!"" Indulge in our fast-acting blueberry dream flavored indica gummies, infused with an impressive 100mg of CBN per package. Each package contains 10 vegan gummies, providing 5mg of nano-emulsified water soluble THC + 5mg of CBN in every delectable bite. Savor the authentic fruit flavor as you relish in the benefits of our premium gummies. In addition to the incredible advantages of cannabis, our CANNABALS blueberry dream flavored indica gummies are specifically formulated to promote sleep and relaxation. The inclusion of 5mg of CBN per gummy enhances the sedative effects, making these gummies perfect for those seeking a restful night's sleep or a moment of deep relaxation. CBN is known for its calming properties and ability to induce a sense of tranquility, making it an ideal choice for those looking to unwind after a long day. With our fast-acting nano-emulsified technology, you can experience the soothing effects of CBN quickly and efficiently. So, whether you're struggling with insomnia or simply need a moment of relaxation, our CANNABALS gummies are here to help you achieve a peaceful state of mind.",100,22
Mango | 100mg,Cannabals,Hybrid,Edibles,100mg,$22.00 ,"Energetic,Happy,Creative,Focused,Inspired,Calm",Not Specified,"Experience the luscious and tropical taste of ripe mangoes with our CANNABALS Mango flavored sativa gummies! These delectable treats not only provide a burst of fruity flavor, but they also offer a fast-acting and potent cannabis experience. Thanks to our innovative nano-emulsified technology, the THC in our gummies is broken down into tiny particles that are easily absorbed by the body. This means that you can start feeling the effects within minutes, allowing you to enjoy the benefits of cannabis without delay. Each package contains 10 vegan gummies, with each gummy delivering a potent 10mg of nano-emulsified water soluble THC. This ensures that you get a consistent and reliable dose with every bite. And with the succulent and tropical taste of ripe mangoes, you'll savor every moment of your cannabis experience. Don't miss out on the mouthwatering sensation - try our Mango flavored sativa gummies today and elevate your cannabis experience to new heights. CANNABALS - cannabis you can eat, with a delicious mango twist!",100,22
Bangin Blueberrv | Gummies | 100mg,Gezoont,Hybrid,Edibles,100mg,$24.00 ,Happy,Not Specified,"Our Bangin Blueberry Gummies are made from the same recipe that won first place in the 2016 Santa Cruz Cup.Hand crafted in small batches we only use real fruit and our finest premium, house made, full spectrum CO2 oil.Indulge in all-natural perfection, elevate, and embrace THC bliss in every moment as nature's power unfolds.Gezoont, Where Culinary Chef and Cannabis Blend....****All our gummies deliver calm, happy, and uplifting effects****",100,24
Kims Karamels | 100mg,Gezoont,Hybrid,Edibles,100mg,$25.00 ,Happy,Not Specified,"Kim?s Caramels are hand crafted in small batches with our in-house made, full spectrum Distillate. Soft, velvety caramels that will melt in your mouth and melt your stress away. Indulge in all-natural perfection, elevate, and embrace THC bliss in every moment as nature's power unfolds.****All our Caramels deliver calm, happy, and uplifting effects****",100,25
Yuzu Lemon 1:1 | Camino | Balance | 100mg,Kiva,Hybrid,Edibles,100mg,$33.00 ,"Relaxed,Clear mind,Calm,Happy",Not Specified,"Harmony is here and now. Dip your feet into the slow current of a cool river. Let the blend of THC and CBD, hybrid-like terpenes, and sweet notes of citrus balance you from the inside out.",100,33
Dark Chocolate with Quinoa Crunch | 20mg,Scandalous,Hybrid,Edibles,20mg,$10.00 ,N/A,Not Specified,"20 mg THC Single sourced Colombian dark chocolate blended with crispy quinoa crunch to create a great tasting, rich cannabis edible.All natural, gluten free, vegan, single source, fair trade.1 Chocolate, 2 servnigs per package. 10mg THC per serving At Scandalous Chocolates, we are deeply committed to quality and sustainability.We source all-natural cacao products from South American farmers who have upheld over a century of fair practice agriculture. This ensures that every ingredient in our chocolates meets the highest standards of purity and flavor. Our carefully handcrafted products are meticulously made, surprisingly affordable and conveniently packaged for the ultimate scandalous experience.",20,10
Matcha Latte Caramel | 10mg 2 Pack,Soft Power Sweets,Hybrid,Edibles,10mg,$12.00 ,"Relaxed,Sleepy,Happy",Not Specified,"A smooth matcha latte caramel made with coconut milk and maple syrup and enriched with white chocolate. Two 10mg THC Caramels Per Unit, 20mg Total",10,12
Raspberry Rainbow Caramel | 2 Pack | 20mg,Soft Power Sweets,Hybrid,Edibles,20mg,$12.00 ,"Relaxed,Clear mind,Calm,Sleepy,Happy",Not Specified,"A bright, fruity, raspberry caramel infused with almond for beautiful marzipan flavor - a rainbow cookie turned into a lush confection. Two 10mg THC Caramels Per Unit, 20mg Total",20,12
Dulce De Leche Caramel | 10mg 2 Pack,Soft Power Sweets,Hybrid,Edibles,20mg,$12.00 ,N/A,Not Specified,"A bright, fruity, raspberry caramel infused with almond for beautiful marzipan flavor - a rainbow cookie turned into a lush confection. Two 10mg THC Caramels Per Unit, 20mg Total",20,12
"High, I Love You | Chocolate | 5 Pack | 50mg",Soft Power Sweets,Hybrid,Edibles,50mg,$25.00 ,Happy,Not Specified,"Soft Power Sweets presents ?High, I Love You?, our take on a classic Valentine?s chocolate tin. It features five 10mg solid hearts in just-dark-enough 65% single origin Ecuadorian chocolate, each one hand-painted in shimmering Valentine?s hues. Say ?High, I Love You? with the best ethically sourced chocolate paired with NY?s best sustainably grown cannabis.",50,25
TTM | Astro Apple | 100mg,To The Moon,Hybrid,Edibles,100mg,$30.00 ,"Energetic,Happy,Creative,Focused,Inspired,Uplifted",Not Specified,"Edibles are created either by infusing cooking oil or butter with cannabis extract, or by mixing extract directly into other ingredients. Because edibles are digested and absorbed by your stomach and liver, the activation is often longer than other consumption methods, taking on average 45 minutes, and sometimes up to 2 hours. It is important to start low and slow when consuming edibles so you don't over do it. Take extra caution to ensure edibles are out of the reach of children.",100,30
