Strain,Company,Types,Categories,THC level,Price,Feelings,Flavor,Description,THC level numeric,Price numeric
Bubble Punch | 5pk | 0.5g,Hepworth,Indica,Vaporizers,20.24%,$24.00 ,"Relaxed,Sleepy,Happy",Not Specified,"Elevate your energy with our meticulously crafted pre-roll pack, thought fully curated to invigorate your senses and inspire productivity. Each pack contains five perfectly rolled 0.5g joints, designed to provide you with a boost of motivation and vitality whenever you need it. Our Energize cannabis category is dedicated to those seeking a dynamic and uplifting experience, and these pre- rolls are no exception.",20,24
Leisure | 1g,Holiday,Indica,Vaporizers,91%,$70.00 ,"Relaxed,Sleepy,Happy",Not Specified,"Bake some leisure into your self-care routine ? you deserve it. Leisure hits first as sweet and tart mango, but finishes with a delicious juicy citrus note reminiscent of yuzu fruit. Nothin? but hammock vibes.",91,70
Nightcap | 1g,Holiday,Indica,Vaporizers,60%,$70.00 ,"Uplifted,Hungry,Relaxed",Not Specified,N/A,60,70
Wedding Cake | 1g,Jaunty,Indica,Vaporizers,90%,$60.00 ,"Relaxed,Aroused,Hungry","Vanilla,pepper,sweet","Wedding Cake, also known as ""Triangle Mints #23,"" is a potent type of indica-hybrid marijuana strain made by crossing Triangle Kush with Animal Mints. Fun fact: In Canada, this strain is known as Pink Cookies. The Wedding Cake strain provides relaxing and euphoric effects that calm the body and mind. This strain yields a rich and tangy flavor profile with undertones of earthy pepper. Medical marijuana patients choose Wedding Cake to help relieve symptoms associated with pain, insomnia and appetite loss. Consumers with a low THC tolerance should enjoy this strain with an extra slice of care due to its high THC content. Wedding Cake has soared in popularity over the years and was named Leafly Strain of the Year in 2019.",90,60
Hash Burger | Live Resin,MFNY,Indica,Vaporizers,82.88%,$48.00 ,"Sleepy,Relaxed,Euphoric","cheese,chestnut,pungent","Hash Burger is a hybrid weed strain. Reviewers on Leafly say this strain makes them feel sleepy, relaxed, and euphoric. If you've smoked, dabbed, or otherwise enjoyed this strain, Hash Burger, before let us know! Leave a review.",82,48
Oishii #4 | Live Resin 510 Cart (.5g),MFNY,Indica,Vaporizers,75.97%,$48.00 ,"Relaxed,Sleepy,Happy",Not Specified,"For our resin hash infused pre-rolls, we start with premium, hand-trimmed whole Oishii #4 flower then infuse it with our in-house made Oishii #4 live resin HTFSE [high terpene full spectrum extract from fresh frozen buds]. This process creates a higher potency product, with sweet, yes gassy flavors of the Oishii #4 strain. Potent and high in THC this product is a treat for experienced cannabis consumer. No shake, no trim. Just the very best of our craft cannabis, ready to enjoy. Exclusively single-sourced at MFNY in the Hudson Valley.",75,48
Watermelon Zkittles | Live Resin | Ready To Use | 1g,Rove,Indica,Vaporizers,91.60%,$95.00 ,"Happy ,Relaxed,Sleepy",Not Specified,"Taste, and feel, a rainbow of effects with this fruity strain that is mouth-wateringly delicious. Earthy, herbaceous undertones and bright fruity citrus meet with a sour overtone that turns slightly pungent in this delicious strain. Despite its bright and complex nose, Watermelon Zkittlez?s effects are best suited for a chill night lazing on the couch or catching some zzz's.",91,95
Pluto Ice | Live Resin Disposable,To The Moon,Indica,Vaporizers,89.65%,$80.00 ,"Relaxed,Sleepy,Happy",Not Specified,"Disposable vaporizers contain concentrated cannabis oil that is heated by an attached battery and inhaled. These products come charged and ready to go, and are not designed to be reused, refilled, or recharged. These products are often very potent and are designed to be consumed in 2-3 second puffs.",89,80
Flight Pack | Landing Sequence | Indica | 5 Pack,Head Space,Indica,Pre-rolls,21.37%,$30.00 ,"Relaxed,Sleepy,Happy",Not Specified,"Rolled up and ready to smoke, Pre-Rolls are a convenient and effective way to consume cannabis. Pre-Rolls come in many different forms and can be rolled with flower, shake, ""b-buds"", infused with concentrates, and more.",21,30
Landing Sequence (Indica) | 1g,Head Space,Indica,Pre-rolls,21.37%,$11.00 ,"Relaxed,Sleepy,Happy",Not Specified,"Rolled up and ready to smoke, Pre-Rolls are a convenient and effective way to consume cannabis. Pre-Rolls come in many different forms and can be rolled with flower, shake, ""b-buds"", infused with concentrates, and more.",21,11
Papaya Cake,Aetema,Indica-Hybrid,Flower,25%,$270.00 ,"Relaxed,Sleepy, Hungry","tropical,mango,apricot","Papaya Cake is a hybrid weed strain made from a genetic cross between Papaya, Wedding Cake, and White OG. Papaya Cake is 24% THC, making this strain an ideal choice for experienced cannabis consumers. Leafly customers tell us Papaya Cake effects include relaxation, drowsiness, and hunger. Medical marijuana patients often choose Papaya Cake when dealing with symptoms associated with anxiety, insomnia, and stress. Bred by Mad Cow Genetics, Papaya Cake features tropical, mango, and apricot flavors. The dominant terpene of this strain is Limonene. The average price of Papaya Cake typically ranges from $35-$45. If you?ve smoked, dabbed, or consumed Papaya Cake, tell us about your experience by leaving a strain review.",25,270
Skywalker OG,Dank,Indica-Hybrid,Flower,30.62%,$53.00 ,"Sleepy,Relaxed,Tingly","spicy herbal,pungent,earthy","Skywalker OG is an Indica-dominant hybrid cannabis strain with a potent THC content ranging from 20% to 30%. It is a cross between Mazar and Blueberry OG strains. The dominant terpenes found in Skywalker OG are myrcene, caryophyllene, and limonene. Skywalker OG is well-known for its relaxing and euphoric effects, making it an excellent choice for stress relief and pain management. This strain is often used to alleviate symptoms of anxiety, depression, and insomnia. The strain's name pays homage to the Star Wars franchise, featuring the namesake of Luke Skywalker himself. Skywalker OG's creators chose to name the strain after the Jedi hero due to its potent, ""forceful"" effects. When it comes to taste and aroma, Skywalker OG has a spicy, herbal flavor with hints of earthy undertones. The top flavors and aromas include diesel, pine, and spicy herbal notes.As for Luke Skywalker, well, we can only imagine him toking up on some Skywalker OG after a long day of fighting the dark side. Perhaps it's even what helped him stay so calm during those intense lightsaber battles. Who knows, maybe Yoda was growing Skywalker OG on Dagobah all along!",30,53
Kiwi Kush,DEALER CANNABIS CO.,Indica-Hybrid,Flower,21.15%,$26.00 ,Relaxed,Not Specified,Dried cannabis flower is primarily ingested via inhalation. Activation time is roughly about 5 minutes and can last up to a few hours.,21,26
Harvest | Skywalker OG,Harvest,Indica-Hybrid,Flower,22.61%,$175.00 ,"Sleepy,Relaxed,Tingly",Not Specified,Dried cannabis flower is primarily ingested via inhalation. Activation time is roughly about 5 minutes and can last up to a few hours.,22,175
Black Scotti | 7 Pk,Florist Farms,Indica-Hybrid,Pre-rolls,25%,$38.00 ,"Focused,Happy,Relaxed,Energetic,Inspired,Uplifted",Not Specified,"Black Scotti is a hybrid weed strain made from a genetic cross between Biscotti and Zhit. This strain is 30% sativa and 70% indica. Black Scotti is 23.5% THC, making this strain an ideal choice for experienced cannabis consumers. Bred by unknown breeders, the average price of Black Scotti typically ranges from $10-$15 per gram. We are still learning about Black Scotti?s effects, flavors, and medical uses. If you've smoked, dabbed, or consumed Black Scotti, please tell us about your experience by leaving a strain review.",25,38
Frosted Infused Flower,Silly Nice,Hybrid,Flower,40%,$60.00 ,N/A,Not Specified,"Welcome to a world where the extraordinary is the norm, and every nug of ""Frosted Flower"" is a ticket to a vibrant escape. Straight from the exclusive strains of Kombucha Cream by Sega Farms, this bud bursts with a potent party of cannabinoids at a dazzling 39.86%, and THC levels that dance up to 33.72%.Dive into a kaleidoscope of terpenes where Myrcene leads the conga line, followed by the spicy swing of Caryophyllene and the citrus twirl of Limonene, all adding up to a total terpene content of 2.2%. It's a flavor festival that'll make your senses sing!And because we're all about keeping it real, we've aced the test for purity. No pesticides or heavy metals here?just pure, unadulterated fun.Kick back and revel in the pure joy of ""Frosted Flower,"" your go-to for good times and great vibes.Just so you know:- Base Flower: Kombucha Cream, grown with care by Sega Farms- Solvents used for THCA powder production: Ethanol, Pentane It's not just cannabis; it's a celebration in a jar!",40,60
Blue Dream | Hash | 0.5g,HUDSON CANNABIS,Sativa,Concentrates,60.00%,$64.00 ,"Creative,Uplifted,Energetic","blueberry,berry,sweet","Blue Dream is a sativa-dominant hybrid marijuana strain made by crossing Blueberry with Haze. This strain produces a balanced high, along with effects such as cerebral stimulation and full-body relaxation. Blue dream is 18% THC but has a low CBD percentage, making this potent strain a fan favorite of both novice and veteran cannabis consumers. In terms of flavor, Blue Dream is reported to smell and taste like sweet berries. Medical marijuana patients often use Blue Dream to treat symptoms of depression, chronic pain, and nausea. Blue Dream originated in California and has since achieved legendary status among West Coast strains and has quickly become one of the most-searched-for strains in the Leafly database. The average price per gram of Blue Dream is $20. Strains similar to Blue Dream include Blue Dream CBD, Double Dream,and Blue Magoo.",60,64
TTM | Strawberry Spacejam | 100mg,To The Moon,Sativa,Edibles,100mg,$30.00 ,"Energetic,Happy,Creative,Focused,Inspired,Uplifted",Not Specified,"Edibles are created either by infusing cooking oil or butter with cannabis extract, or by mixing extract directly into other ingredients. Because edibles are digested and absorbed by your stomach and liver, the activation is often longer than other consumption methods, taking on average 45 minutes, and sometimes up to 2 hours. It is important to start low and slow when consuming edibles so you don't over do it. Take extra caution to ensure edibles are out of the reach of children.",100,30
TTM | Space Unicorn | 100mg,To The Moon,Sativa,Edibles,100mg,$30.00 ,"Energetic,Happy,Creative,Focused,Inspired,Uplifted",Not Specified,"Edibles are created either by infusing cooking oil or butter with cannabis extract, or by mixing extract directly into other ingredients. Because edibles are digested and absorbed by your stomach and liver, the activation is often longer than other consumption methods, taking on average 45 minutes, and sometimes up to 2 hours. It is important to start low and slow when consuming edibles so you don't over do it. Take extra caution to ensure edibles are out of the reach of children.",100,30
TTM | Electric Lemonade | 100mg,To The Moon,Sativa,Edibles,100mg,$30.00 ,"Energetic,Happy,Creative,Focused,Inspired,Uplifted",Not Specified,"Edibles are created either by infusing cooking oil or butter with cannabis extract, or by mixing extract directly into other ingredients. Because edibles are digested and absorbed by your stomach and liver, the activation is often longer than other consumption methods, taking on average 45 minutes, and sometimes up to 2 hours. It is important to start low and slow when consuming edibles so you don't over do it. Take extra caution to ensure edibles are out of the reach of children.",100,30
Strawberry | Social | CBG | 10 Pack,Florist Farms,Sativa,Edibles,100mg,$30.00 ,"Happy,Relaxed,Calm,Energetic",Not Specified,"NY?s finest hybrid cannabis extract measured and dosed with precision for a reliable experience that hits the sweet spot between relaxed and energized. These picnic-basket-ready strawberry gummies will have you feeling fine.INGREDIENTS: Corn Syrup, sugar, gelatin (bovine), sorbitol, citric acid, modified food starch (corn), flavoring, sunflower oil, Cannabis sativa extract, food coloring (Yellow #5, Red #40, Red #3)",100,30
Sour Watermelon | Energize | THC-V | 10 Pack,Florist Farms,Sativa,Edibles,100mg,$30.00 ,"Calm,Happy,Relaxed,Energetic",Not Specified,NY?s finest hybrid cannabis extract measured and dosed with precision for a reliable experience that hits the sweet spot between relaxed and energized. These Sour Green Apple Gummies are a throwback to some one of our favorite flavors as kids and they don?t disappoint - in flavor or effects.,100,30
Bedtime Blueberry Sleep Gummies | 10 Pack,Florist Farms,Sativa,Edibles,100mg,$30.00 ,"Calm,Happy,Relaxed,Energetic",Not Specified,NY?s finest hybrid cannabis extract measured and dosed with precision for a reliable experience that hits the sweet spot between relaxed and energized. These Sour Green Apple Gummies are a throwback to some one of our favorite flavors as kids and they don?t disappoint - in flavor or effects.,100,30
Golden Raspberry Gummies | 10 Pack,Florist Farms,Sativa,Edibles,100mg,$30.00 ,"Calm,Happy,Relaxed,Energetic",Not Specified,NY?s finest hybrid cannabis extract measured and dosed with precision for a reliable experience that hits the sweet spot between relaxed and energized. These Sour Green Apple Gummies are a throwback to some one of our favorite flavors as kids and they don?t disappoint - in flavor or effects.,100,30
Peach Gummies | 10 Pack,Florist Farms,Sativa,Edibles,100mg,$30.00 ,"Calm,Happy,Relaxed,Energetic",Not Specified,NY?s finest hybrid cannabis extract measured and dosed with precision for a reliable experience that hits the sweet spot between relaxed and energized. These Sour Green Apple Gummies are a throwback to some one of our favorite flavors as kids and they don?t disappoint - in flavor or effects.,100,30
Sour Green Apple | 10 Pack,Florist Farms,Sativa,Edibles,100mg,$30.00 ,"Calm,Happy,Relaxed,Energetic",Not Specified,NY?s finest hybrid cannabis extract measured and dosed with precision for a reliable experience that hits the sweet spot between relaxed and energized. These Sour Green Apple Gummies are a throwback to some one of our favorite flavors as kids and they don?t disappoint - in flavor or effects.,100,30
Sweet Peach | 100mg,Jaunty,Sativa,Edibles,100mg,$24.00 ,"Calm,Happy,Relaxed,Energetic",Not Specified,Summer?s here! Grab a bag of Jaunty?s Sweet Peach gummies and celebrate the season with this quintessential flavor of summertime. Each delicious piece packs 10mg THC to add a special pep in your step.,100,24
Sour Watermelon | 100mg,Jaunty,Sativa,Edibles,100mg,$24.00 ,"Energetic,Talkative,Uplifted","diesel,pungent,skunk","Sour Diesel, also known as ""Sour D"" and ""Sour Deez,"" is a popular hybrid marijuana strain made by crossing Chemdawg and Super Skunk. Sour Diesel effects are dreamy, cerebral, fast-acting and energizing. This strain features a pungent flavor profile that smells like diesel. Medical marijuana patients choose Sour Diesel to help relieve symptoms associated with depression, pain, and stress. Fun fact: Sour Diesel first became popular in the early 1990s and has been legendary ever since.",100,24
Mango Habanero x Spicy Papaya | Rosin Gummies,MFNY,Sativa,Edibles,100mg,$30.00 ,"Energetic,Focused,Uplifted","lemon,pepper,citrus","A must for edible lovers, these palate-pleasing Pink Lemonade x Lemoncane gummies are unlike any other edibles you've tried. Our vegan, full-spectrum, cultivar-specific gummies are infused with MFNY?s premium Lemoncane live rosin extract. Superior to distillate, live rosin is made via solventless extraction from premium fresh frozen plants, preserving all the natural terpenes. We use the minimum amount of sugar to highlight the spicy pineapple flavors of the Pinezapple, paired with natural flavors of pineapple.",100,30
Limelight | 100mg,Off Hours,Sativa,Edibles,100mg,$30.00 ,"Energetic,Focused,Tingly","lime,citrus,pine","Limelight, also called Rockstar, is a hybrid cannabis strain bred by Kali Grown Seeds in 2018, made from a genetic cross of (Key Lime Pie x Lemon Tree) x Kali Grown OG. Citrus is on the menu. Limelight looks how it smells: Vibrant, electric-green buds that reek of limonene-rich terps with an earthy base. A perfect, tangy way to start the day. If you?ve smoked, dabbed, or consumed Limelight, tell us about your experience by leaving a strain review.",100,30
Awaken | 100mg,Off Hours,Sativa,Edibles,100mg,$30.00 ,"Creative,Energetic,Focused,Happy,Inspired",Not Specified,Off Hours orange punch Awaken gummies are specially formulated with an eye-opening blend of THC and THCV to energize your day.,100,30
Private Party,DEALER CANNABIS CO.,Sativa,Flower,22.43%,$26.00 ,"focused,Happy,Relaxed,Energetic",Not Specified,Dried cannabis flower is primarily ingested via inhalation. Activation time is roughly about 5 minutes and can last up to a few hours.,22,26
Harvest | Power Plant ,Harvest,Sativa,Flower,21.52%,$45.00 ,"Energetic,Happy,Creative,Focused,Inspired",Not Specified,Dried cannabis flower is primarily ingested via inhalation. Activation time is roughly about 5 minutes and can last up to a few hours.,21,45
Wet Dream,Zizzle,Sativa,Flower,22%,$54.00 ,"Energetic,Creative,Uplifted","sage,blue cheese,spicy herbal","Wet Dream, also known as ""Wet Dreams,"" is native to San Diego, California. Wet Dream is a sativa-dominant cross between Blue Dream and OB Haze (Ocean Beach Haze). While its ever-so appealing name might lead you to believe this strain is best for late night indulgence, the upbeat jolt of energy Wet Dream provides is favored by many for daytime use. Its uplifting cerebral effects are ushered in by a spicy lemongrass aroma and a woody pine flavor. While Haze hybrids tend to induce racing euphoria that can be a bit jarring for some, the Blue Dream genetics bring a mellow, relaxing quality to the experience to help curb stress and anxiety.",22,54
Silver Haze,Zizzle,Sativa,Flower,20.97%,$54.00 ,"Energetic,Happy,Creative,Focused,Inspired,Uplifted",Not Specified,"Silver Haze, a distinguished sativa-dominant hybrid with a landrace genetic makeup, earned legendary status as the first-place winner of New York State's inaugural Legal Cannabis Cup. Cultivated by Zizzle, it epitomizes excellence in the cannabis world.Bred by Sensi Seeds in the 1980s, Silver Haze is a masterful blend of Haze, Northern Lights, and Skunk, enriched with subtle traits from the original Trainwreck strain. Boasting a potent THC content of 18% to 24%, it delivers a powerful, uplifting, and cerebral high that sparks creativity, induces euphoria, and enhances focus, a favorite among both recreational and medical users.The strain's captivating aroma and flavor profile, featuring citrus, pine, and spice notes, contribute to Silver Haze's allure, making it a connoisseur's choice. Its appearance is equally striking, with elongated, slender buds displaying a vibrant green hue and a generous trichome coating.Zizzle's cultivation excellence shines through, as demonstrated in their commitment to precision, care, and innovation, resulting in Silver Haze surpassing expectations of judges and consumers alike. The strain's victory in the Legal Cannabis Cup marks a milestone in New York State's post-legalization era, solidifying its place in cannabis history. As Silver Haze embodies the best of its genetic lineage and Zizzle's craftsmanship, it is poised to continue setting new standards for quality and excellence in the evolving world of cannabis..",20,54
Blue Dream,Harvest,Sativa,Flower,24%,$45.00 ,"Creative,Uplifted,Energetic","blueberry,berry,sweet","Blue Dream is a sativa-dominant hybrid marijuana strain made by crossing Blueberry with Haze. This strain produces a balanced high, along with effects such as cerebral stimulation and full-body relaxation. Blue dream is 18% THC but has a low CBD percentage, making this potent strain a fan favorite of both novice and veteran cannabis consumers. In terms of flavor, Blue Dream is reported to smell and taste like sweet berries. Medical marijuana patients often use Blue Dream to treat symptoms of depression, chronic pain, and nausea. Blue Dream originated in California and has since achieved legendary status among West Coast strains and has quickly become one of the most-searched-for strains in the Leafly database. The average price per gram of Blue Dream is $20. Strains similar to Blue Dream include Blue Dream CBD, Double Dream,and Blue Magoo.",24,45
Party | Hella Jelly | 2 Pack,Honeybee Collective,Sativa,Pre-rolls,19.08%,$15.50 ,"Creative,Uplifted,Energetic,Focused",Not Specified,"PARTY - An Energetic, Happy Experience Perfect for a day on the slopes, a summer BBQ, or a deep house clean, these pre-rolls bring the party energy",19,15.5
Sour Diesel ,Dank,Sativa,Pre-rolls,23%,$16.00 ,"Energetic,Talkative,Uplifted","diesel,pungent,skunk","Sour Diesel, also known as ""Sour D"" and ""Sour Deez,"" is a popular hybrid marijuana strain made by crossing Chemdawg and Super Skunk. Sour Diesel effects are dreamy, cerebral, fast-acting and energizing. This strain features a pungent flavor profile that smells like diesel. Medical marijuana patients choose Sour Diesel to help relieve symptoms associated with depression, pain, and stress. Fun fact: Sour Diesel first became popular in the early 1990s and has been legendary ever since.",23,16
Lavender | Botanicals | 2 Pack,Drew Martin,Sativa,Pre-rolls,33%,$20.00 ,"Focused,Happy,Relaxed,Energetic,Inspired,Uplifted",Not Specified,"BE OPEN | Rose Petal + Hybrid The gentle aroma of rose petals envelops you, clearing your mind. A refreshing tingle of peppermint swirls around the hybrid cannabis cultivar leaving you feeling balanced and more open to the world around you. You exhale, ?Be open.? This curated blend of cannabis and botanicals was formulated by Drew Martin, an award-winning mixologist and herbalist, to harness the power of plants through cannabinoids, terpenes, and botanicals.",33,20
Candy Jack | Live Resin Infused | 5 Pack,Florist Farms,Sativa,Pre-rolls,42%,$40.00 ,"Energetic,Creative,Uplifted","sweet,citrus,pine","Candy Jack is a mostly sativa strain that provides a swift boost to your mood alongside a sweet, citrus aroma. The fragrant smell is inherited from its Skunk #1 parent, while creative and focused effects stem from the Jack Herer side of the family. While its complex terpene profile may impress even the most hardened connoisseur, patients typically appreciate Candy Jack?s ability to counter stress, depression, and appetite loss. With a few Cannabis Cup wins already under its belt, Candy Jack?s potency, flavor, and effects have won this sativa a sterling reputation in the cannabis world. ",42,40
THCv | Live Resin Infused | 5 Pack,Florist Farms,Sativa,Pre-rolls,39%,$40.00 ,"Focused,Happy,Relaxed,Energetic,Inspired,Uplifted",Not Specified,"Rolled up and ready to smoke, Pre-Rolls are a convenient and effective way to consume cannabis. Pre-Rolls come in many different forms and can be rolled with flower, shake, ""b-buds"", infused with concentrates, and more.",39,40
Blue Dream | 1g,Harvest,Sativa,Pre-rolls,17.49%,$14.00 ,"Creative,Uplifted,Energetic","blueberry,berry,sweet","Blue Dream is a sativa-dominant hybrid marijuana strain made by crossing Blueberry with Haze. This strain produces a balanced high, along with effects such as cerebral stimulation and full-body relaxation. Blue dream is 18% THC but has a low CBD percentage, making this potent strain a fan favorite of both novice and veteran cannabis consumers. In terms of flavor, Blue Dream is reported to smell and taste like sweet berries. Medical marijuana patients often use Blue Dream to treat symptoms of depression, chronic pain, and nausea. Blue Dream originated in California and has since achieved legendary status among West Coast strains and has quickly become one of the most-searched-for strains in the Leafly database. The average price per gram of Blue Dream is $20. Strains similar to Blue Dream include Blue Dream CBD, Double Dream,and Blue Magoo.",17,14
Sour Diesel | 3 Pack,Zizzle,Sativa,Pre-rolls,23%,$28.00 ,"Energetic,Talkative,Uplifted","diesel,pungent,skunk","Sour Diesel, also known as ""Sour D"" and ""Sour Deez,"" is a popular hybrid marijuana strain made by crossing Chemdawg and Super Skunk. Sour Diesel effects are dreamy, cerebral, fast-acting and energizing. This strain features a pungent flavor profile that smells like diesel. Medical marijuana patients choose Sour Diesel to help relieve symptoms associated with depression, pain, and stress. Fun fact: Sour Diesel first became popular in the early 1990s and has been legendary ever since.",23,28
Super Lemon Haze | 1g,Verde Lucido,Sativa,Pre-rolls,20%,$12.00 ,"Energetic,Uplifted,Creative","lemon,citrus,lime","Super Lemon Haze, sometimes called ""SLH,"" is a sativa-dominant hybrid marijuana strain of Lemon Skunk and Super Silver Haze and two time Cannabis Cup winner from Green House Seeds. Super Lemon Haze is a kief-caked multi-colored wonder. As the name states this strain has real lemony characteristics. The smell is zesty, citrusy, and a little sweet. As for the taste, it's everything one would expect from the namesake; tart and sweet like lemonheads candy - not quite as sharp as one might expect. The effects are uniquely energetic and lively, may not be the best strain for those of us that are naturally wound-up tight.",20,12
